,0,1
2726,Коми Республикаын Роспотребнадзорлӧн веськӧдланін йӧзӧдіс коронавирус серти официальнӧй юӧр ,Официальная информация Управления Роспотребнадзора по Республике Коми по ситуации с коронавирусом 
2727,"Коми Республикаын Роспотребнадзорлӧн веськӧдланін юӧртіс: талун кежлӧ (йирым тӧлысь 30 лун вылӧ) лабораторнӧя эскӧдӧма, мый COVІD-19 висьмӧма 13157 (+231) морт.","По официальной информации Управления Роспотребнадзора по Республике Коми, на сегодняшний день (30 октября) лабораторно подтверждено 13157 (+231) случаев заболевания COVID-19."
2728,"Став висьмӧм йӧз бӧрся видзӧдӧны врачьяс, налы сетӧны отсӧг.","Все инфицированные находятся под наблюдением врачей, им оказывается помощь."
2729,"Ставнас медицина боксянь видзӧдӧны 6031 морт бӧрся, на лыдын: 6014 морт контактируйтӧмаӧсь висьмӧм йӧзкӧд, 17-ыс воӧмаӧсь суйӧр сайысь.","Всего под медицинским наблюдением находится 6031 человек, из них 6014 контактировали с заболевшими, 17 прибыли из-за рубежа."
2730,9884 (+191) морт бурдіс.,9884 (+191) человека выздоровело.
2731,"Официальнӧя эскӧдісны, мый коронавирусысь кувсис 218 (+4) пациент.",Официально подтверждено 218 (+4) случаев летального исхода у пациентов с коронавирусом.
2732,Бӧръя суткинас медицина боксянь обследуйтӧм да кык вежонся карантин помасьӧм бӧрын медицина учёт вылысь киритісны 182 мортӧс.,За последние сутки сняты с медицинского учёта по завершении обследований и двухнедельного карантинного срока 182 человека.
2733,Найӧ коронавирусӧн оз висьны.,В отношении них подозрения на коронавирус не подтвердились.
2734,***Уськӧдам тӧд вылӧ.,***Напоминаем вам о том.
2735,"Медым Ті энӧ висьмӧй коронавирус инфекцияӧн, быть колӧ кутчысьны видзчысян мераясӧ.",Что защититься от коронавирусной инфекции невозможно без соблюдения мер предосторожности.
2736,"Мыськӧй кинытӧ, кор локтанныд удж вылӧ либӧ гортӧ.","Всегда мойте руки, когда приходите на работу или возвращаетесь домой."
2737,Сідзжӧ позьӧ вӧдитчыны васӧд салфеткаясӧн либӧ дезинфицируйтан растворъясӧн.,Для профилактики также подойдут влажные салфетки или дезинфицирующие растворы.
2738,"Энӧ вӧрӧдӧй чужӧмнытӧ киӧн, энӧ ниртӧй нырнытӧ да синъяснытӧ.","Не трогайте лицо руками, не подносите руки к носу и глазам."
2739,Медся кокньыда вирусыс веськалӧ организмӧ ныр-вомті.,Быстрее всего вирус попадает в организм через слизистую оболочку.
2740,Пыдди пуктӧй да видзӧй ӧта-мӧднытӧ – кутӧй социальнӧй костъяс.,Уважайте и берегите друг друга – соблюдайте социальную дистанцию.
2741,Вӧдитчӧй маскаясӧн.,Используйте индивидуальные средства защиты – маски.
2742,Ковтӧг некытчӧ энӧ ветлӧдлӧй да кутчысьӧй йӧзаинъясысь бокын.,Избегайте ненужных поездок и массового скопления людей.
2743,"Торйӧн нин тайӧ корӧмъясӧ колӧ кутчысьны олӧма йӧзлы да налы, кодъяслӧн эмӧсь хроническӧй висьӧмъяс.","Особенно это касается людей старшего возраста и тех, кто имеет хронические заболевания."
2744,Видзӧй асьнытӧ да матыссаяснытӧ!,Защитите себя и своих близких!
2745,Коми язык,Русский язык
2746,Владимир Уйба вӧзйис Россияса регионъяслы ӧтвылысь сӧвмӧдны пытшкӧсса туризм ,Владимир Уйба предложил регионам России сообща развивать внутренний туризм 
2747,Коми Республикаса Юралысь видеосвязь пыр пырӧдчис Россия Федерацияын пытшкӧсса туризм сӧвмӧдӧм серти Веськӧдлан котырса комиссиялӧн заседаниеӧ.,Глава Республики Коми в режиме видеосвязи принял участие в заседании Правительственной комиссии по развитию туризма в Российской Федерации.
2748,Заседаниеӧн веськӧдліс Россияса Веськӧдлан котырӧн Юрнуӧдысьӧс вежысь Дмитрий Чернышенко.,Под председательством Заместителя Председателя Правительства России Дмитрия Чернышенко.
2749,"«Миян канмуса регионъяслы оз ков венласьны быд турист вӧсна, а колӧ лӧсьӧдны ӧта-мӧдкӧд ӧтув уджалан система.","«Регионы нашей страны не должны конкурировать между собой за каждого туриста, а выстроить синергетическую систему взаимодействия друг с другом."
2750,"Торйӧн нин маті регионъяслы, кодъяслӧн ӧтувъя историяыс, культураыс да вӧр-ва аслыспӧлӧслунъясыс кыскӧны ветлысь-мунысьясӧс.","Особенно регионы-соседи, чьи историко-культурные традиции и природные особенности представляют интерес для путешественника именно в своей целостности."
2751,"Ме серти, тайӧ тӧдчымӧн сӧвмӧдас туризмсӧ кыдзи Коми Республикаын, сідзи и Россияын», - юӧртіс Владимир Уйба.","На мой взгляд, это даст серьезный толчок развитию туризма как в Республике Коми, так и в России», - заявил Владимир Уйба."
2752,"Шуам, Коми Республика мутасын эм Россияса сизим чуймӧданторъяс пиысь ӧти – Маньпупунёр из бӧлбанъяс.","Например, на территории Республики Коми расположено одно из семи чудес России – плато Маньпупунёр с семью каменными великанами-останцами."
2753,"Тайӧ став мувывса тӧдчанлуна вӧр-ва объект, сылы 200 миллион сайӧ во.","Это объект природного наследия мирового значения, его возраст более 200 миллионов лет."
2754,"Коми Республика пуктӧ ас водзас мог, медым став мирса ветлысь-мунысьяс вермисны аддзывны тайӧ чуймӧданторсӧ.",Республика Коми ставит перед собой цель – обеспечить доступность этого чуда для путешественников со всего мира.
2755,"Тайӧс позьӧ вӧчны сӧмын Коми Республикалысь, Перым мулысь, Свердловск обласьтлысь, Ханты-Мансийскӧй кытшлысь вынъяссӧ ӧтлаӧдӧмӧн.","Достичь этой цели можно, объединив ресурсы Республики Коми с ресурсами Пермского края, Свердловской области, Ханты-Мансийского округа."
2756,Тайӧ регионъяссӧ йитӧны Урал гӧраяс.,Эти регионы связывают Уральские горы.
2757,Сэні нуӧдӧны нин уна тур.,На территории которых уже действуют десятки туров.
2758,Уралса кластеръяслысь позянлунъяссӧ ӧтлаӧдӧмӧн позьӧ ёна сӧвмӧдны Урал гӧраяс вылысь туризмсӧ.,"Объединив возможности уральских кластеров, можно в разы увеличить эффективность реализации рекреационных проектов, повысить коэффициент узнаваемости и популярности туризма на территории Уральских гор."
2759,Коми язык,Русский язык
2760,Владимир Уйба пырӧдчис «Коми войтыр» дінмукостса ӧтйӧза ӧтмунӧмса исполкомлӧн заседаниеӧ ,Владимир Уйба принял участие в заседании исполкома МОД «Коми войтыр» 
2761,Коми Республикаса Юралысь лыддис дзоньвидзалун видзӧм да туй отрасльяс сӧвмӧдӧм серти доклад.,Глава Республики Коми выступил с докладами по вопросам развития отрасли здравоохранения и дорожного хозяйства.
2762,"Владимир Уйба юӧртіс сы йылысь, кутшӧм могъяс матысса кад вылӧ сувтӧдӧма Коми Республикаса Веськӧдлан котыр водзын йӧзлысь дзоньвидзалун видзан юкӧнса инфраструктура выльмӧдӧм могысь.","Владимир Уйба рассказал о задачах, стоящих в ближайшей перспективе перед Правительством Республики Коми, по модернизации инфраструктуры отрасли здравоохранения."
2763,Владимир Уйбалӧн Владимир Путинкӧд онлайн-аддзысьлӧм дырйи Россия Федерация Президент сетіс кык тшӧктӧм.,По итогам онлайн встречи Владимира Уйба с Владимиром Путиным Президентом Российской Федерации даны два поручения.
2764,"Сы могысь, медым збыльмӧдны медводдза тшӧктӧмсӧ, республикаса Йӧзлысь дзоньвидзалун видзан министерство дасьтіс Коми Республикаса йӧзлысь дзоньвидзалун видзан медводдза юкӧн выльмӧдан регионса уджтас бала.",Во исполнение первого поручения минздравом республики разработан проект региональной программы модернизации первичного звена здравоохранения Республики Коми.
2765,Тайӧ уджтас серти кыпӧдасны 63 объект.,В соответствии с ним будет построено 63 объекта.
2766,Налӧн ӧтувъя доныс 3 миллиард сайӧ шайт.,Стоимостью более 3 млрд рублей.
2767,Сідзжӧ капитальнӧя дзоньталасны 40 объект.,А также будет проведён капремонт 40 объектов.
2768,Та вылӧ видзасны 253 миллион шайт.,На сумму 253 млн рублей.
2769,Россия Федерация йӧзлысь дзоньвидзалун видзан министерствоӧн уджтассӧ вынсьӧдӧм да 2021-2025 вояс вылӧ лимитъяс урчитӧм бӧрын лоӧ тӧдса стӧча вичмӧдӧм сьӧм ыдждаыс да мероприятиеяс олӧмӧ пӧртан кадколастыс.,Конкретный объём финансирования и сроки реализации мероприятий будут определены после утверждения программы Министерством здравоохранения Российской Федерации с последующим определением лимитов на 2021-2025 годы.
2770,Республикаса сьӧмкудйысь тайӧ уджтассӧ сьӧмӧн кӧсйӧны могмӧдны 10% мындаын.,Софинансирование программы из республиканского бюджета планируется в размере 10%.
2771,Президентлӧн мӧд тшӧктӧмыс йитчӧма Республикаса перинатальнӧй шӧрин стрӧитӧмкӧд.,Второе поручение Президента касается строительства Республиканского перинатального центра.
2772,Сэні лоӧ 260 койка да ӧти сменаӧ вермасны сэтчӧ волыны 120 морт.,Мощность которого составит до 260 коек и 120 посещений в смену.
2773,"Проект дасьтан да стрӧитан уджлӧн ылӧсас доныс лоӧ 4,7 миллиард шайт.","Ориентировочная стоимость его проектирования и строительства составляет 4,7 млрд рублей."
2774,Сійӧс кыпӧдӧм вылӧ ӧні корсьӧны му участок.,Сейчас идёт поиск земельного участка.
2775,"Сы могысь, медым сиктъясын сӧвмӧдны медводдза медицина отсӧг сетӧмсӧ, колӧ выльмӧдны санитарнӧй машинаяслысь парксӧ.",Развитие первичной медицинской помощи на селе требует существенного обновления парка санитарных машин.
2776,Россия Федерацияса Веськӧдлан котырлӧн 2020 во сора тӧлысь 11 лунся 1806-р №-а тшӧктӧм серти таво республикаӧ воас регыдъя медицина отсӧг сетан «В» класса 28 машина.,В соответствии с распоряжением Правительства Российской Федерации от 11 июля 2020 года № 1806-р в этом году республика получит 28 автомобилей скорой медицинской помощи класса «В».
2777,Найӧс юкласны муниципалитетъяслы да Неминучаӧ веськалӧмалы медицина отсӧг сетан Коми Республикаса мутас шӧринлы.,Они будут распределены между муниципалитетами и Территориальным центром медицины катастроф Республики Коми.
2778,"2020-2021 вояс вылӧ республикаса адреснӧй инвестиция уджтас бала серти стрӧитасны ФАП-ъяс: витӧн Изьва да Кӧрткерӧс районъясын, нёльӧс – Кулӧмдін районын, ӧтикӧн Емдін, Сыктывдін, Сыктыв, Сосногорск, Усинск районъясын (ставнас - 19 ФАП).","В рамках республиканской адресной инвестиционной программы на 2020-2021 годы планируется построить 19 ФАПов: 5 – в Ижемском районе, 5 – Корткеросском, 4 – Усть-Куломском, по одному – в Усть-Вымском, Сыктывдинском, Сысольском, Сосногорском и Усинском районах."
2779,Сьӧмсӧ сетасны 300 миллион сайӧ шайт.,Объём финансирования составит более 300 млн рублей.
2780,Объектъяссӧ кӧсйӧны пыртны уджӧ 2021 воын.,Планируемый срок ввода объектов в эксплуатацию – 2021 год.
2781,Коми Республикаса Юралысь тшӧктӧма республикаса Веськӧдлан котырлы бурмӧдны йӧзлысь дзоньвидзалун видзан юкӧнын кадръяс серти ситуациясӧ.,Главой Республики Коми даны поручения Правительству республики по улучшению кадровой ситуации в отрасли здравоохранения.
2782,Та могысь содтӧма велӧдчысьяслысь лыдсӧ: таво кырымалӧма специалитет уджтас серти целевӧя велӧдчӧм йылысь 95 сёрнитчӧм да ординатура уджтас серти велӧдчӧм йылысь 41 сёрнитчӧм.,Увеличено число обучающихся: в этом году заключено 95 договоров о целевом обучении по программам специалитета и 41 договор по программам ординатуры.
2783,«Бурдӧдан делӧ» специальносьт вылӧ республикаса сьӧмкудйысь вештысьӧмӧн велӧдасны 20 студентӧс.,За счёт средств республиканского бюджета на специальность «Лечебное дело» зачислено 20 студентов.
2784,50-ысь унджыкӧн вермасны босьтны медицинаын шӧр тшупӧда тӧдӧмлун.,На 50 увеличено число мест для обучающихся на специалистов со средним медицинским образованием.
2785,"2,5 пӧв содтӧма «Земскӧй доктор» да «Земскӧй фельдшер» уджтас серти сьӧмӧн могмӧдӧмсӧ.","В 2,5 раза увеличено финансирование программ «Земский доктор» и «Земский фельдшер»."
2786,"2019 воын вӧлі вичмӧдӧма 32,5 миллион шайт, а 2020 воын - 83 миллион шайт.","В 32,5 млн рублей в 2019 году до 83 млн рублей в 2020-м."
2787,"2020 воын урчитӧма 48 миллион сайӧ шайт Сыктывкарын, Ухтаын да Печораын медицинаын уджалысьяслы 19 патера ньӧбӧм вылӧ.","В 2020 году предусмотрено свыше 48 млн рублей на приобретение 19 квартир для медицинских работников в городах Сыктывкар, Ухта, Печора."
2788,Коми язык,Русский язык
2789,Коми Республикаын Роспотребнадзорлӧн веськӧдланін йӧзӧдіс коронавирус серти официальнӧй юӧр ,Официальная информация Управления Роспотребнадзора по Республике Коми по ситуации с коронавирусом 
2790,"Коми Республикаын Роспотребнадзорлӧн веськӧдланін юӧртіс: талун кежлӧ (йирым тӧлысь 29 лун вылӧ) лабораторнӧя эскӧдӧма, мый COVІD-19 висьмӧма 12926 (+225) морт.","По официальной информации Управления Роспотребнадзора по Республике Коми, на сегодняшний день (29 октября) лабораторно подтверждено 12926 (+225) случаев заболевания COVID-19."
2791,"Став висьмӧм йӧз бӧрся видзӧдӧны врачьяс, налы сетӧны отсӧг.","Все инфицированные находятся под наблюдением врачей, им оказывается помощь."
2792,"Ставнас медицина боксянь видзӧдӧны 5826 морт бӧрся, на лыдын: 5807 морт контактируйтӧмаӧсь висьмӧм йӧзкӧд, 19-ыс воӧмаӧсь суйӧр сайысь.","Всего под медицинским наблюдением находится 5826 человек, из них 5807 контактировали с заболевшими, 19 прибыли из-за рубежа."
2793,9693 (+148) морт бурдіс.,9693 (+148) человека выздоровело.
2794,Ӧнія кадӧ коронавирусысь некод эз кувсьы.,Новых случаев летального исхода у пациентов с коронавирусом не зарегистрировано.
2795,Бӧръя суткинас медицина боксянь обследуйтӧм да кык вежонся карантин помасьӧм бӧрын медицина учёт вылысь киритісны 125 мортӧс.,За последние сутки сняты с медицинского учёта по завершении обследований и двухнедельного карантинного срока 125 человек.
2796,Найӧ коронавирусӧн оз висьны.,В отношении них подозрения на коронавирус не подтвердились.
2797,***Уськӧдам тӧд вылӧ.,***Напоминаем вам о том.
2798,"Медым Ті энӧ висьмӧй коронавирус инфекцияӧн, быть колӧ кутчысьны видзчысян мераясӧ.",Что защититься от коронавирусной инфекции невозможно без соблюдения мер предосторожности.
2799,"Мыськӧй кинытӧ, кор локтанныд удж вылӧ либӧ гортӧ.","Всегда мойте руки, когда приходите на работу или возвращаетесь домой."
2800,Сідзжӧ позьӧ вӧдитчыны васӧд салфеткаясӧн либӧ дезинфицируйтан растворъясӧн.,Для профилактики также подойдут влажные салфетки или дезинфицирующие растворы.
2801,"Энӧ вӧрӧдӧй чужӧмнытӧ киӧн, энӧ ниртӧй нырнытӧ да синъяснытӧ.","Не трогайте лицо руками, не подносите руки к носу и глазам."
2802,Медся кокньыда вирусыс веськалӧ организмӧ ныр-вомті.,Быстрее всего вирус попадает в организм через слизистую оболочку.
2803,Пыдди пуктӧй да видзӧй ӧта-мӧднытӧ – кутӧй социальнӧй костъяс.,Уважайте и берегите друг друга – соблюдайте социальную дистанцию.
2804,Вӧдитчӧй маскаясӧн.,Используйте индивидуальные средства защиты – маски.
2805,Ковтӧг некытчӧ энӧ ветлӧдлӧй да кутчысьӧй йӧзаинъясысь бокын.,Избегайте ненужных поездок и массового скопления людей.
2806,"Торйӧн нин тайӧ корӧмъясӧ колӧ кутчысьны олӧма йӧзлы да налы, кодъяслӧн эмӧсь хроническӧй висьӧмъяс.","Особенно это касается людей старшего возраста и тех, кто имеет хронические заболевания."
