,0,1,2,3
0,Коми язык,Русский язык,,
1,Ухтаын кӧсйӧны заводитны вӧчны вылыс качествоа кориз ,В Ухте планируется создать производство высококачественной извести ,,
2,Коми Республикаса Юралысьлысь могъяс недыр кадколастӧ збыльмӧдысь Владимир Уйба удж серти аддзысьліс «Стрӧитчан материалъяс вӧчан Ухтаса завод» ичӧт кывкутана котырса веськӧдлысьяскӧд.,Врио Главы Республики Коми Владимир Уйба провёл рабочую встречу с руководством ООО «Ухтинский завод строительных материалов».,,
3,Компания пӧртӧ олӧмӧ войтыркостса корӧмъяслы лӧсялана ИФ-0 качествоа кориз вӧчӧм серти инвестиция проект.,"Компания реализует инвестиционный проект по организации выпуска извести качества ИФ-0, соответствующей высоким международным требованиям.",,
4,"Аддзысьлігӧн сёрнитісны проект олӧмӧ пӧртӧм йылысь да сы йылысь, кыдзи Коми Республикаса Веськӧдлан котыр вермас отсавны инвесторлы.","На встрече рассмотрены вопросы реализации проекта и поддержки, которую может оказать инвестору Правительство Республики Коми.",,
5,Коризсӧ кутасны вӧчны Бельгопса куйлӧдын.,Инвестпроект по созданию производства высококачественной извести реализуется на базе Бельгопского месторождения.,,
6,Тайӧ Тиманса коризлӧн ыджыд да туялӧм куйлӧд.,Это наиболее крупное и изученное на Тимане месторождение известняков.,,
7,Артмӧма сійӧ 380 млн гӧгӧр во сайын сёр девонлӧн сирачойскӧй свитаын.,"Относящихся к сирачойской свите позднего девона, сформировавшихся около 380 млн лет назад.",,
8,Корсьысьӧмъясыс заводитчисны 1937 воӧ.,Его разведка началась в 1937 году.,,
9,"Карбонатнӧй породаясысь 1963 восянь перйисны бут, посньӧдлӧм из да кориз пызь.","Карбонатные породы разрабатывались с 1963 года как бут, щебень и известняковая мука.",,
10,"Бельгопса куйлӧдӧ пырӧ нёль кориз участок – Бельгоп-1, Бельгоп-2, Бельгоп-3, Бельгоп-4.","В состав Бельгопского месторождения входят четыре участка известняков – Бельгоп-1, Бельгоп-2, Бельгоп-3, Бельгоп-4.",,
11,"Коризыс бур, лӧсялӧ посньӧдлӧм излӧн 400-600 маркалы, унджыкыс – 600 марка.",Качество известняков на всех участках высокое и отвечает маркам щебня 400-600 с преобладанием 600.,,
12,"«СМУЗ» котыр Бельгоп-1 куйлӧдын вӧчӧ нин кӧтӧдтӧм, кӧтӧдӧм да гидравлическӧй кориз.","ООО «УЗСМ» уже использует известняки месторождения Бельгоп-1 и специализируется на производстве негашеной, гашеной и гидравлической извести.",,
13,"Водзӧ вылӧ кӧсйӧны вуджны и мукӧд участок вылӧ, содтыны вӧчаслысь ыдждасӧ да бурмӧдны качествосӧ, чинтыны асдонсӧ.","В планах – освоить другие участки, тем самым увеличить объём выпуска продукции, улучшить и стабилизир",,
14,Коризлӧн ногтуйыс кутас лӧсявны ИФ-0 стандартлы.,Качество выпускаемой извести будет соответствовать требованиям стандарта извести ИФ-0.,,
15,"Татшӧм коризыс колӧ металлургия да химия отрасльяслы, и талун Россияын татшӧм коризсӧ некод оз вӧч.",Востребованной потребителями металлургической и химической отраслей и на сегодняшний день не производимой в Российской Федерации.,,
16,2020 вося ода-кора тӧлысь 13 лунӧ кырымалӧма Коми Республикаса Веськӧдлан котыр да «Стрӧитчан материалъяс вӧчан Ухтаса завод» ичӧт кывкутана котыр костын уджъёртасьӧм йылысь артмӧдчӧм.,"13 мая 2020 года подписано соглашение о сотрудничестве между Правительством Республики Коми и ООО «УЗСМ», направленное на реализацию данного инвестпроекта.",,
17,Сійӧс веськӧдӧма инвестиция проектсӧ олӧмӧ пӧртӧм вылӧ.,Он рассчитан на несколько лет и разбит на пять основных этапов.,,
18,Уджыс кутас мунны некымын во да юкӧма вит медшӧр юкӧн вылӧ.,Первый предполагает реконструкцию участка по производству извести.,,
19,Медводз кутасны выльмӧдны кориз вӧчан участоксӧ да стрӧитны F2S сикаса кориз донӧдан кык шахтаа пач.,Строительство одной двухшахтной печи для обжига извести типа F2S.,,
20,Суткинас сійӧ кутас вӧчны 350-400 тонна природнӧй биару сотан системаӧн.,Производительностью 350 – 400 т/сут. с системой сжигания природного газа.,,
21,Бӧръянас кутасны стрӧитны кос ногӧн цемент вӧчан завод.,Финальный этап – строительство завода по производству цемента.,,
22,Сылӧн вынйӧрыс лоӧ вонас 1 млн. тонна.,Сухим способом мощностью 1 млн тонн/г.,,
23,Проектыс вермас сетны удж 1200 мортлы.,Реализация проекта позволит создать до 1200 рабочих мест.,,
24,"«Проектыс социальнӧй да экономика боксянь ыджыд тӧдчанлуна Ухта карлы да ставнас республикалы, – донъяліс регионса веськӧдлысь Владимир Уйба.","«Проект имеет экономическую и социальную значимость для Ухты и Республики Коми в целом, - дал оценку врио Главы Республики Коми Владимир Уйба.",,
25,– Республикалы колӧны татшӧм промышленнӧй производство сӧвмӧдан инновация проектъяс.,"– Республика нуждается в таких инновационных проектах, обеспечивающих рост промышленного производства.",,
26,"Республика вермас вӧчны продукция, коді колӧ оз сӧмын республикаын да странаын, но и кутас мунны экспорт вылӧ».","Реализация этого проекта позволит наладить выпуск конкурентоспособной продукции, востребованной не только в республике и в стране, но идущей на экспорт».",,
27,Коми язык,Русский язык,,
28,"Владимир Уйба видзӧдліс, кыдзи стрӧитӧны Сыктывдінса Выльгорт сиктын 270 места вылӧ челядьӧс видзанін ",Владимир Уйба проинспектировал ход строительства детского сада на 270 мест в селе Выльгорт Сыктывдинского района ,,
29,3 арӧсӧдз челядьӧс школаӧдз тӧдӧмлун босьтны позянлунӧн могмӧдӧм – тайӧ Россияса Президент Владимир Путинӧн пуктӧм мог.,Поставленных Президентом России Владимиром Путиным по обеспечению 100-процентной доступности дошкольного образования для детей в возрасте до 3 лет.,,
30,Тайӧ могсӧ олӧмӧ пӧртӧм могысь Выльгортын лэптӧны кык судтаа кирпич стрӧйба.,Строительство двухэтажного кирпичного здания ведётся в рамках исполнения задач,,
31,Объектсӧ пыртӧма Коми Республикаса 2019 во да 2020 да 2021 воясся планӧвӧй кадколаст вылӧ адреснӧй инвестиция уджтасӧ.,Объект включён в адресную инвестиционную программу Республики Коми на 2019 год и плановый период 2020 и 2021 годов.,,
32,Смета серти доныс – 253 миллионысь унджык шайт.,Сметная стоимость – более 253 миллионов рублей.,,
33,"Тайӧ федеральнӧй, республиканскӧй да меставывса сьӧмкудъясысь сьӧм.","Это средства федерального, республиканского и местного бюджетов.",,
34,Стрӧитчан да монтаж уджъяссӧ вӧчӧ «Альфа-Строй» ичӧт кывкутана котыр.,Строительно-монтажные работы выполняет ООО «Альфа-Строй».,,
35,Сійӧ заводитіс уджсӧ 2019 вося нёльӧд кварталын.,К строительству подрядчик приступил в четвёртом квартале 2019 года.,,
36,Сёрнитчӧм серти уджсӧ колӧ помавны таво помӧдз.,В соответствии с договором объект должен быть сдан до конца года.,,
37,"Но ӧні тыдовтчис, мый уджыс мунӧ график торкалӧмӧн.",Сейчас работы ведутся с отставанием от графика.,,
38,"Стрӧйбасӧ кыпӧдӧма 90 прӧчент вылӧ, ортсы везъяс дасьӧсь 30 прӧчент вылӧ, пытшкӧсса везъяс – 15 прӧчент вылӧ.","Конструкция здания готова на 90 процентов, внешние сети – на 30 процентов, внутренние – на 15 процентов.",,
39,Кӧч тӧлысь помын воас модульнӧй биаруӧн ломтысьыс котельнӧй.,В конце сентября поступит модульная газовая котельная.,,
40,Объект вылын уджалӧ 44 морт.,На объекте работает 44 человека.,,
41,Коми Республикаса Юралысьлысь могъяс недыр кадколастӧ збыльмӧдысь Владимир Уйба тшӧктіс регионса Стрӧитчан министерстволы да Сыктывдін районса Администрациялы босьтны объектсӧ торъя контроль улӧ,Врио Главы Республики Коми Владимир Уйба поручил Минстрою республики и Администрации Сыктывдинского района держать объект на особом контроле.,,
42,Пӧдрадчикъяслы шуӧма содтыны уджалысьяслысь лыд да уджлысь ӧдсӧ.,Подрядной организации необходимо увеличить количество работников на стройплощадке и ускорить темпы работ.,,
43,Коми язык,Русский язык,,
44,Коми Республикаын Роспотребнадзорлӧн веськӧдланін йӧзӧдіс коронавирус серти официальнӧй юӧр ,Официальная информация Управления Роспотребнадзора по Республике Коми по ситуации с коронавирусом ,,
45,"Ставнас медицина боксянь видзӧдӧны 1914 морт бӧрся, на лыдын: 1883 морт контактируйтӧмаӧсь висьмӧм йӧзкӧд, 31-ыс воӧмаӧсь суйӧр сайысь.","Всего под медицинским наблюдением находится 1914 человек, из них 1883 контактировали с заболевшими, 31 прибыл из-за рубежа.",,
46,"Официальнӧя эскӧдісны, мый коронавирусысь некод эз кувсьы.",Новых случаев летального исхода у пациентов с коронавирусом не зарегистрировано.,,
47,Коми язык,Русский язык,,
48,"Воркутаса вӧвлӧм мэр, Россияса ӧтйӧза палатаӧ пырысь Игорь Шпекторкӧд прӧщайтчисны талун Санкт-Петербургын ","Церемония прощания с бывшим мэром Воркуты, членом Общественной палаты России Игорем Шпектором прошла сегодня в Санкт-Петербурге ",,
49,Коми Республикаса Юралысьлысь могъяс недыр кадколастӧ збыльмӧдысь Владимир Уйба да Коми Республикаса Веськӧдлан котыр нимсянь панихидаын участвуйтіс Коми Республикаса Веськӧдлан котырӧн Юрнуӧдысьӧс вежысь – сьӧм овмӧс министр Галина Рубцова.,От имени врио Главы республики Коми Владимира Уйба и Правительства региона в панихиде приняла участие заместитель Председателя Правительства Республики Коми – министр финансов Галина Рубцова.,,
50,«Сьӧкыд воштыны татшӧм йӧзсӧ.,«Тяжело терять таких людей.,,
51,"Игорь Леонидовичӧс бура тӧдісны эз сӧмын республикаын, но и Россияын.",Масштаб личности Игоря Леонидовича выходил далеко за пределы республики.,,
52,"Сійӧ дас воысь дырджык уджаліс Воркутаса мэрӧн, вӧзйис нуӧдны «Заполярные игры» Войвылын олысь йӧзлы спартакиада, дорйис войвывса йӧзлысь тӧждъяссӧ Россияса ӧтйӧза палатаын.","Более десяти лет он работал мэром Воркуты, был инициатором проведения спартакиады народов Севера «Заполярные игры», активно защищал интересы северян в Общественной палате России.",,
53,Сійӧ кужис корсьны петан туйяс зэв сьӧкыд могъяс олӧмӧ пӧртігӧн.,Он умел находить решения самых сложных задач.,,
54,И пыр вӧлі восьса йӧзлы.,Проявляя при этом открытость и неравнодушие к проблемам людей.,,
55,Пыр пыдди пуктіс Мортӧс.,Человечность – вот главная черта этой личности.,,
56,"Сылысь уджсӧ кутасны помнитны и Воркутаса, и Коми Республикаса олысьяс, - пасйис Галина Рубцова.","Его работу всегда будут помнить воркутинцы и все жители Республики Коми», - отметила Галина Рубцова.",,
57,Игорь Шпектор кувсис кӧч тӧлысь 5 лунӧ.,Игорь Шпектор скончался 5 сентября.,,
58,Аслас 82 арӧсӧдз эз ов сӧмын тӧлысь.,Не дожив всего месяц до своего 82-летия.,,
59,Коми язык,Русский язык,,
60,Сыктывкарын воссис челядьлы да том войтырлы уна мога шӧрин ,В Сыктывкаре открылся многофункциональный центр для детей и молодежи ,,
61,Шӧрин кыпыда воссис кӧч тӧлысь 10 лунӧ.,"В торжественной церемонии, которая состоялась 10 сентября.",,
62,Воліс сэтчӧ Коми Республикаса Юралысьлысь могъяс недыр кадколастӧ збыльмӧдысь Владимир Уйба.,Принял участие временно исполняющий обязанности Главы Республики Коми Владимир Уйба.,,
63,"«Шӧриныс ӧнія кадлы лӧсялана, тані выль оборудованньӧ, выль техника, – пасйис В. Уйба.","«Центр современный, с новым оборудованием и техникой. Но важен подход, - отметил В. Уйба.",,
64,"Тані быдтӧны оз сӧмын чемпионъясӧс да вермысьясӧс, тані быдтӧны прамӧй йӧзӧс.","Здесь не просто растят чемпионов, победителей, здесь воспитывают настоящих людей.",,
65,"Тайӧ тӧдчӧ велӧдысьяслӧн, мукӧд специалистъяслӧн уджын.","Это чувствуется в отношении педагогов, в отношении специалистов.",,
66,"Найӧ радейтӧны быдтасъяснысӧ, сетӧны налы став олӧмнысӧ.","Людей, которые относятся к детям с любовью, посвящают им свою жизнь.",,
67,Тайӧ шӧринас быдтӧны великӧй страналысь гражданинъясӧс».,"Это центр, где формируются граждане нашей великой страны».",,
68,"Регионӧн веськӧдлысьлы петкӧдлісны выль жыръяс да залъяс, висьталісны клубъяс да организацияяс йылысь, кутшӧмъяс кутасны уджавны шӧринын.","Врио Главы Республики Коми показали новые помещения и залы, рассказали о клубах и организациях, которые будут работать в новом центре.",,
69,Уна мога шӧрин – челядьлы содтӧд тӧдӧмлун сетан учреждение.,Многофункциональный центр – учреждение дополнительного образования для детей.,,
70,"Тані лоӧ позянлун пырӧдчыны турист да чужан му туялӧм нырвизьӧ, патриотическӧй, физкультура да спорт нырвизьӧ.","Занимающихся по программам туристко-краеведческой, патриотической, физкультурно-спортивной направленности.",,
71,Сідзжӧ тані лоӧ позянлун нуӧдны челядьлы да том войтырлы уна сикас мероприяттьӧ.,А также пространство для проведения детских и молодежных мероприятий.,,
72,Шӧрин кутас котыртны республикаса челядьлысь шойччӧм да дзоньвидзалун видзӧм.,Центр станет организатором отдыха и оздоровления детей республики.,,
73,"2020 воӧдз челядьлӧн да том войтырлӧн республикаса шӧринлысь занятиеяс, ордйысьӧмъяс, семинаръяс, велӧдчан-тренируйтчан сборъяс ковмыліс нуӧдны республикаса велӧдчан да спорт организацияясын.","До 2020 года занятия, соревнования, семинары и учебно-тренировочные сборы, организованные республиканским центром детей и молодежи, проходили на базе образовательных и спортивных организаций республики.",,
74,Колісны ас жыръяс.,Необходимы были собственные помещения.,,
75,Выль уна мога шӧрин – дыр виччысяна велӧдчанін.,"Новый многофункциональный центр – это долгожданная образовательная территория, оснащенная современным оборудованием.",,
76,Катаев улича вылын стрӧйбаын челядьлы сетӧма кык судта.,Детям отданы два этажа здания по улице Катаева.,,
77,"Медводдза судтаас туризм, карта да компас серти корсьӧм, чужан му туялӧм серти занятиеяс нуӧдӧм вылӧ жыръяс, челядьлы да том йӧзлы туризм история музей.","Один этаж занимают кабинеты для проведения занятий по туризму, спортивному ориентированию, краеведению, музей истории детско-юношеского туризма.",,
78,Тані жӧ воссис Юнармия керка.,Также здесь открылся дом Юнармии.,,
79,"Мӧд судтаас – ӧнія скалодрома спорт зал, актӧвӧй да тренируйтчан зал.","На другом этаже расположены спортивный зал с современным скалодромом, актовый и тренажерный залы.",,
80,Шӧринӧ кутасны волыны 700 кымын ныв-зон.,В Центре будут заниматься около 700 ребят.,,
81,Тані кутасны нуӧдны республикаса челядьлы тӧдчана мероприяттьӧ.,Будут проводиться общественно-значимые мероприятия для детей республики.,,
82,Владимир Уйбалы петкӧдлісны и кӧч тӧлысь медводдза лунӧ восьтӧм Сыктывкарса 40 номера торъя коррекционнӧй школаса начальнӧй классъяслы корпус.,Также Владимиру Уйба показали открытый первого сентября корпус для начальных классов специальной коррекционной школы № 40 города Сыктывкар.,,
83,Сійӧ сідз жӧ Катаев уличвывса стрӧйбалӧн медводдза судтаын.,Корпус располагается на первом этаже здания по улице Катаева.,,
