,0,1,2,3
217,2019 вося ӧшым тӧлысь 26 лунӧ кырымалӧма уджъяс вӧчӧм вылӧ канму контракт.,Госконтракт на выполнение работ заключён 26 декабря 2019 года.,,
218,2020 вося ода-кора тӧлысьын объект вылын заводитісны нуӧдны стрӧитчан да монтажнӧй уджъяс.,Строительно-монтажные работы на объекте начаты в мае 2020 года.,,
219,Уджъяссӧ кӧсйӧны помавны 2021 вося йирым тӧлысьын.,Окончание работ и ввод объекта в эксплуатацию запланированы на октябрь 2021 года.,,
220,Доныс – 1 млрд 132 млн шайт.,Стоимость – 1 млрд 132 млн рублей.,,
221,2020 во вылӧ урчитӧм сьӧм мындаысь видзӧма нин 95%-сӧ.,"Уже освоено 95% от лимитов средств, предусмотренных на 2020 год.",,
222,"Такӧд йитӧдын Владимир Уйба шыӧдчис Марат Хуснуллин дорӧ вӧзйӧмӧн юклыны 2021 во вылӧ урчитӧм лимитъяссӧ выль пӧв да вуджӧдны 2020 во вылӧ федеральнӧй сьӧмсӧ, мыйта вӧлі планируйтӧма вичмӧдны локтан воын индӧм туй участоксӧ выльмӧдӧм вылӧ.","В связи с этим Владимир Уйба обратился к Марату Хуснуллину с предложением перераспределить лимиты 2021 года и перенести на 2020 год федеральные средства, которые были запланированы на финансирование мероприятий по реконструкции указанного участка дороги на следующий год.",,
223,Тайӧ сетас позянлун эштӧдны уджъяссӧ планируйтӧм кадысь водзджык.,Это позволит завершить работы раньше запланированного срока.,,
224,Россия Федерацияса Веськӧдлан котырӧн Юрнуӧдысьӧс вежысь ошкис Владимир Уйбалысь водзмӧстчӧмсӧ да тшӧктіс видлавны тайӧ юалӧмсӧ.,Заместитель Председателя Правительства Российской Федерации поддержал инициативу врио Главы Республики Коми и поручил проработать данный вопрос.,,
225,Матысса кадӧ Россияса Веськӧдлан котыр дасьтас та серти лӧсялана тшӧктӧм.,В ближайшее время будет подготовлено соответствующее распоряжение Правительства России.,,
226,Коми язык,Русский язык,,
227,Коми Республикаын Роспотребнадзорлӧн веськӧдланін йӧзӧдіс коронавирус серти официальнӧй юӧр ,Официальная информация Управления Роспотребнадзора по Республике Коми по ситуации с коронавирусом ,,
228,"Коми Республикаын Роспотребнадзорлӧн веськӧдланін юӧртіс: талун кежлӧ (кӧч тӧлысь 3 лун вылӧ) лабораторнӧя эскӧдӧма, мый COVІD‑19 висьмӧма 6644 (+24) морт.","По официальной информации Управления Роспотребнадзора по Республике Коми, на сегодняшний день (3 сентября) лабораторно подтверждено 6644 (+24) случая заболевания COVID-19.",,
229,"Став висьмӧм йӧз бӧрся видзӧдӧны врачьяс, налы сетӧны отсӧг.","Все инфицированные находятся под наблюдением врачей, им оказывается помощь.",,
230,"Ставнас медицина боксянь видзӧдӧны 1399 морт бӧрся, на лыдын: 1386 морт контактируйтӧмаӧсь висьмӧм йӧзкӧд, 13-ыс воӧмаӧсь суйӧр сайысь.","Всего под медицинским наблюдением находится 1399 человек, из них 1386 контактировали с заболевшими, 13 прибыли из-за рубежа.",,
231,5751 (+48) морт бурдіс.,5751 (+48) человек выздоровел.,,
232,Ӧнія кадӧ коронавирусысь некод эз кувсьы.,Новых случаев летального исхода у пациентов с коронавирусом не зарегистрировано.,,
233,Бӧръя суткинас медицина боксянь обследуйтӧм да кык вежонся карантин помасьӧм бӧрын медицина учётысь киритісны 32 мортӧс.,За последние сутки сняты с медицинского учёта по завершении обследований и двухнедельного карантинного срока 32 человека.,,
234,Найӧ коронавирусӧн оз висьны.,В отношении них подозрения на коронавирус не подтвердились.,,
235,"*** Содтӧд дасьлун режим йылысь регионса юрнуӧдысьлӧн Индӧдӧн, вына дзескӧдӧмъясӧн да Коми Республикаын серпас йылысь выль юӧрӧн позьӧ тӧдмасьны Коми Республикалӧн официальнӧй порталын “Коронавирус.","*** Ознакомиться с Указом Главы Республики Коми о режиме повышенной готовности, действующими ограничениями и оперативной информацией о ситуации в Республике Коми можно на официальном портале Республики Коми в специальном разделе «Коронавирус.",,
236,Коми язык,Русский язык,,
237,Владимир Уйба нуӧдіс Культура да искусство серти сӧветлысь паськӧдӧм заседание ,Владимир Уйба провёл расширенное заседание Совета по культуре и искусству ,,
238,Заседаниеыс вӧлі кӧч тӧлысь 2 лунӧ Финн-угор этнокультурнӧй паркын.,Заседание состоялось 2 сентября в Финно-угорском этнокультурном парке.,,
239,Коми Республикаса Юралысьлысь могъяс недыр кадколастӧ збыльмӧдысь сёрнитіс культура учреждениеясӧн юрнуӧдысьяскӧд да творческӧй котыръясӧс петкӧдлысьяскӧд республикалы сё во тыригкежлӧ дасьтысьӧм да юкӧнсӧ водзӧ вылӧ сӧвмӧдӧм йылысь.,Врио Главы Республики Коми обсудил с руководителями учреждений культуры и представителями творческих союзов вопросы подготовки к столетию республики и перспективы развития отрасли.,,
240,"“Коми Республика талун лоӧ медбурӧн культура юкӧнын уна нырвизьын: ми восьтам сиктъясын социокультурнӧй шӧринъяс, модельнӧй  библиотекаяс, котыртам аслыспӧлӧс выставкаяс, - тӧдчӧдіс чолӧмалан кывйын Владимир Уйба.","«Республика Коми сегодня является уверенным лидером по очень многим направлениям в сфере культуры: мы открываем в сельских районах социокультурные центры, модельные библиотеки, организуем уникальные выставки, - подчеркнул в приветственном слове Владимир Уйба.",,
241,- Талун “Культура” национальнӧй проектлӧн уна нырвизь лӧсьӧдӧма дыр кад вылӧ.,- Сегодня очень многие направления нацпроекта «Культура» ориентированы на долгосрочную перспективу.,,
242,"Чайта, мый республикаса ӧтйӧза ӧтувъяслы быть колӧ пырӧдчыны тайӧ уджӧ”.","И, конечно, считаю принципиально важным участие в этой работе творческих общественных объединений республики».",,
243,В. Уйба сідзжӧ пасйис республикалӧн социальнӧй уджъёртъяслысь культура юкӧн сӧвмӧдӧмын пайсӧ.,В. Уйба также отметил вклад социальных партнёров республики в развитие отрасли культуры.,,
244,"Сідз, шуам, “РУСАЛ” компаниякӧд уджъёртасьӧм йылысь артмӧдчӧм серти моз тӧлысь 26 лунӧ Княжпогост районса Чимиавӧрӧк посёлокын воссис социокультурнӧй шӧрин.","Так, например, в рамках соглашения о сотрудничестве с компанией «РУСАЛ» 26 августа открылся социокультурный центр в посёлке Чиньяворык Княжпогостского района.",,
245,Регыд воссяс Чилимдін районса Мӧскашор сиктын социальнӧй шӧрин.,На очереди – открытие социокультурного центра в селе Коровий Ручей Усть-Цилемского района.,,
246,Сійӧс стрӧитӧны “ЛУКОЙЛ” компания отсӧгӧн.,Который строится при поддержке компании «ЛУКОЙЛ».,,
247,Тавося сора тӧлысьӧ восьтісны Вуктыл районса Пӧдчерем сиктын социокультурнӧй шӧрин.,В июле этого года открыт социокультурный центр в селе Подчерье Вуктыльского района.,,
248,Сэні участвуйтіс Россияса культура министр Ольга Ярилова.,При участии заместителя министра культуры России Ольги Яриловой.,,
249,Национальнӧй проект серти во помӧдз нӧшта кыкӧс восьтасны Сыктыв да Сосногорск районъясын.,Ещё два в рамках нацпроекта будут открыты до конца этого года в Сысольском и Сосногорском районах.,,
250,Вужвойтырлысь шылада-драмаа театр лӧсьӧдысь да художественнӧй юрнуӧдысь Светлана Горчакова кыпӧдіс театрлы выль здание стрӧитӧм йылысь юалӧм.,Создатель и художественный руководитель Национального музыкально-драматического театра Светлана Горчакова подняла вопрос о строительстве нового здания для театра.,,
251,"Стрӧитӧм вылӧ сійӧ вӧзйис кык ин, а выль здание стрӧитігӧн водзӧ дзоньтавны Бабушкин, 4 улича вылысь жыръяссӧ.","Она предложила два варианта мест для постройки, а на время строительства нового здания продолжить ремонт помещений на улице Бабушкина, 4.",,
252,Владимир Уйба тшӧктіс республикаса Стрӧитчан министерстволы да Культура министерстволы видлавны тайӧ вӧзйӧмъяссӧ.,Владимир Уйба поручил Минстрою и Минкультуры республики проработать эти предложения.,,
253,"Леткаса овмӧдчӧминкостса клуб системалӧн директор Ольга Можегова юаліс Коми Республикаса Юралысьлысь могъяс недыр кадколастӧ збыльмӧдысьлысь, лоасны-ӧ сиктын культура юкӧнын уджалысьяслы канмусянь отсалан мераяс.","Директор Летской межпоселенческой клубной системы Ольга Можегова спросила врио Главы Республики Коми, будут ли предусмотрены какие-либо меры господдержки для работников культуры на селе.",,
254,"Владимир Уйба пасйис, мый 2021 вося тӧвшӧр тӧлысь 1 лунсянь кутас уджавны “Культура юкӧнын земскӧй уджалысь” федеральнӧй уджтас.","Владимир Уйба отметил, что с 1 января 2021 года стартует федеральная программа «Земский работник культуры».",,
255,Сійӧ ышӧдас том специалистъясӧс уджавны сиктса культура учреждениеясын.,Она будет способствовать привлечению молодых специалистов в сельские учреждения культуры.,,
256,"Аддзысьлігӧн сідзжӧ сёрнитісны республикаса Опера да балет канму театрлы выль здание стрӧитӧм, Коми Республикаса национальнӧй галереялысь фонд паськӧдӧм, Воркутаын Шахтёръяслӧн культура двореч дзоньталӧм да оборудование выльмӧдӧм йылысь.","На встрече были также затронуты темы строительства нового здания Государственного театра оперы и балета республики, пополнения фондов Национальной галереи Республики Коми, ремонта и обновления оборудования Дворца культуры шахтёров в Воркуте.",,
257,Владимир Уйба сетіс культура юкӧнын уджалысьяслы канму наградаяс.,Владимир Уйба вручил представителям сферы культуры государственные награды.,,
258,*** Коми Республикаса Юралысьлӧн Индӧдӧн Коми Республика водзын заслугаясысь “Коми Республикаса нимӧдана уджалысь” почёт ним сетӧма,*** Указом Главы Главы Республики Коми за заслуги перед Республикой Коми почетное звание «Заслуженный работник Республики Коми» присвоено,,
259,Сергей Евгеньевич Павлюшинлы – Коми Республикаса культура озырлун объектъяс видзӧмӧн веськӧдланінса начальникӧс вежысьлы;,Павлюшину Сергею Евгеньевичу – заместителю начальника Управления Республики Коми по охране объектов культурного наследия;,,
260,Коми Республикаса Юралысьлӧн тшӧктӧмъясӧн культура юкӧнын заслугаясысь да уна во сьӧлӧмсянь уджалӧмысь “Коми Республикаса культураын почёта уджалысь” ним сетӧма,распоряжениями Главы Республики Коми за заслуги в области культуры и многолетнюю добросовестную работу звание «Почетный работник культуры Республики Коми» присвоено,,
261,Олеся Федоровна Якимовалы – “Эжваса челядьлы шылада школа” содтӧд тӧдӧмлун сетан муниципальнӧй асшӧрлуна учреждениеса директорлы;,Якимовой Олесе Федоровне – директору муниципального автономного учреждения дополнительного образования «Эжвинская детская музыкальная школа»;,,
262,"культура да искусство сӧвмӧдӧмӧ пай пуктӧмысь, уна во зіля уджалӧмысь Коми Республикаса Юралыссянь Аттьӧалӧм сетӧма","за вклад в развитие культуры и искусства, многолетнюю плодотворную деятельность Благодарность Главы Республики Коми объявлена",,
263,Ольга Михайловна Можеговалы – “Леткаса овмӧдчӧминкостса клуб система” муниципальнӧй сьӧмкуд культура учреждениеса директорлы.,Можеговой Ольге Михайловне – директору муниципального бюджетного учреждения культуры «Летская межпоселенческая клубная система».,,
264,Коми язык,Русский язык,,
265,Владимир Уйба ошкис Коми Республикаса Юралысь бердын Экологическӧй сӧвет лӧсьӧдӧм йылысь мӧвпсӧ ,Владимир Уйба поддержал идею о создании Экологического совета при Главе Республики Коми ,,
266,Тайӧ мӧвпсӧ вӧзйисны Коми Республикаса Юралысьлысь могъяс недыр кадколастӧ збыльмӧдысьлӧн экологическӧй организацияясӧс петкӧдлысьяскӧд аддзысьлігӧн.,Такое предложение прозвучало на встрече врио Главы Республики Коми с представителями экологических организаций.,,
267,"Аддзысьлӧмыс вӧлі моз тӧлысь 31 лунӧ В. Уйбалӧн водзмӧстчӧм серти шыӧдчӧмъяс вылӧ вочавидзӧм могысь, кутшӧмъяс воисны экология вӧсна тӧждысьысьяссянь.","Встреча состоялась 31 августа по инициативе В. Уйба в ответ на обращения, поступившие от экологических общественников.",,
268,"“Колӧ торйӧн ёна видзны пармалысь, тундралысь, ю-тыяслысь аслыспӧлӧс да кокниа торкны позяна экосистемасӧ, быдмӧгъясӧс да пемӧсъясӧс.","«Вопросы сохранения уникальной и хрупкой экосистемы тайги и тундры, охраны рек и озер, растительного и животного мира, воспроизводства лесов.",,
269,"Миян республикаын ыджыд тӧдчанлун босьтӧ вӧръяс рӧдмӧдӧм, – пасйис Владимир Уйба аддзысьлӧмын участвуйтысьясӧс чолӧмалігӧн.","Для нашей республики имеют колоссальное значение, - подчеркнул Владимир Уйба, приветствуя участников встречи.",,
270,Республикалӧн озыр вӧр-ваӧн колӧ вӧдитчыны видзчысьӧмӧн да сы понда тӧждысьӧмӧн.,Поэтому надо бережно и рачительно использовать богатые ресурсы республики.,,
271,"Колӧ мӧвпавны сы йылысь, мый ми колям асланым челядьлы да внукъяслы.","Важно, что мы оставим после себя нашим детям и внукам, ",,
272,"Та вӧсна колӧ лӧсьӧдны экологическӧй стандарт, медым урчитны экологическӧй безопасносьтлысь правилӧяс.","В связи с этим назрела необходимость разработки экологического стандарта, призванного регламентировать правила экологической безопасности.",,
273,Тайӧ правилӧясӧ ковмас зумыда кутчысьны республикаса став предприятиелы”.,"Обязательные к исполнению всеми предприятиями, работающими на территории республики».",,
274,"Коми Республикаса Юралысьлысь могъяс недыр кадколастӧ збыльмӧдысь тӧдчӧдіс, мый тайӧ документсӧ дасьтӧмӧ колӧ пырӧдчыны республикаса став колана власьт органлы, предприятиелы да экология организациялы.","По мнению врио Главы Республики Коми, к разработке такого документа должны подключиться все заинтересованные органы власти, предприятия республики и экологические организации.",,
275,"Аддзысьлігӧн нӧшта сёрнитісны экология да гӧгӧртас видзан юкӧнын проектъяс збыльмӧдӧм, республикаын ёг торйӧн чукӧртӧм, экология велӧдӧм, школаса лесничествояслӧн уджалӧм йылысь.","На встрече были обсуждены также вопросы, связанные с реализацией проектов в сфере экологии и охраны окружающей среды, организацией в республике раздельного сбора мусора, внедрением экологического образования, работой школьных лесничеств.",,
276,Владимир Уйбалӧн тшӧктӧм серти республикаса Веськӧдлан котыр видлалас аддзысьлӧм дырйи кыпӧдӧм став вӧзйӧмсӧ.,"По поручению Владимира Уйба все предложения, озвученные в ходе встречи, взяты Правительством республики в проработку.",,
277,На лыдын – Коми Республикаса Юралысь бердын Экологическӧй сӧвет лӧсьӧдӧм.,В их числе – создание Экологического совета при Главе Республики Коми.,,
278,"“Коми Республикаын, кӧні шемӧсмӧдана вӧр-ва, быдмӧны нэмӧвӧйся пуяс, визувтӧны сӧстӧм юяс да тыяс, колӧ быть лӧсьӧдны татшӧм орган, коді кутас анализируйтны, систематизируйтны да ладмӧдны экология юкӧнын нуӧдан став уджсӧ, сы лыдын ӧтйӧза организацияясӧн.","«В Республике Коми, с её удивительной природой, девственными лесами, чистыми реками и озёрами, обязательно должен быть такой орган, который будет анализировать, систематизировать и координировать всю работу, проводимую сегодня, в том числе общественными организациями, в сфере экологии.",,
