,0,1,2,3
84,"Велӧдан кабинетъяс кындзи тані эм музыкальнӧй класс, логопедлӧн, педагог-психологлӧн, дефектологлӧн жыръяс да медицинскӧй кабинет.","Кроме учебных кабинетов, здесь есть музыкальный класс, кабинеты логопеда, педагога-психолога, дефектолога и медицинский кабинет.",,
85,Коми язык,Русский язык,,
86,Владимир Уйба нуӧдіс Республиканскӧй стадион выльмӧдӧм серти оперативнӧй сӧвещание ,Владимир Уйба провёл оперативное совещание по вопросам реконструкции Республиканского стадиона ,,
87,Сӧвещаниеыс вӧлі кӧч тӧлысь 10 лунӧ спорт объектын.,Совещание состоялось 10 сентября на территории спортивного объекта.,,
88,Буретш тані 2021 воын лоас мужичӧй командаяс пӧвстын Мача хоккейысь мирса чемпионат.,Который после реконструкции примет Чемпионат мира по хоккею с мячом среди мужских команд 2021 года.,,
89,Стадионсӧ заводитісны выльмӧдны колян вося ӧшым тӧлысьӧ.,Реконструкция началась в декабре прошлого года.,,
90,Уджалӧны Сербияса стрӧитчысьяс.,Работы выполняет строительная компания из Сербии.,,
91,"Тыдовтчис, мый уджыс мунӧ ньӧжйӧджык урчитӧм серти.",В настоящее время есть отставание от плана-графика работ.,,
92,"Сӧвещание дырйи Коми Республикаса Юралысьлысь могъяс недыр кадколастӧ збыльмӧдысь Владимир Уйба, стрӧитчан да туй овмӧс министр Андрей Некрасов да пӧдрада организацияса веськӧдлысьяс аддзисны стадион выльмӧдан удж ӧддзӧдан ног.","В ходе совещания врио Главы Республики Коми Владимир Уйба, министр строительства и дорожного хозяйства Андрей Некрасов и руководители подрядных организаций выработали совместные решения по ускорению темпов работ по реконструкции объекта.",,
93,"«Ёртъяс, ме ог кӧсйы кывзыны сьӧкыдлунъяс вылӧ некутшӧм ыстысьӧм.","«Коллеги, я не принимаю никаких отговорок.",,
94,"Нинӧм вылӧ видзӧдтӧг уджъяссӧ колӧ нуӧдны водзӧ, – тӧдчӧдіс Владимир Уйба.","Несмотря ни на что работы должны продолжаться, - подчеркнул Владимир Уйба.",,
95,"– Ті верстьӧ йӧз, тӧданныд, кутшӧм климат зонаын ми олам да уджалам.","– Вы не маленькие дети: когда брались за работу, понимали, в каких климатических условиях мы живём и работаем.",,
96,"Гожӧм помасис, ставсӧ шымыртана шондӧдӧм оз ло, ковид некытчӧ оз вош.","Лето закончилось, глобального потепления не будет, ковид как был, никуда не денется.",,
97,Сы вӧсна миян ковмас корсьны петан туй татшӧм оласногын.,"Поэтому надо принимать меры исходя из той действительности, в которой мы находимся.",,
98,"Ми босьтім нин содтӧд уджалысьясӧс, но тыдовтчис, мый йӧзыс бара на этша.","С момента нашей прошлой встречи вы увеличили количество работников, но этого недостаточно.",,
99,"Сідзкӧ, колӧ босьтны нӧшта уджалысьясӧс, медым кӧдздӧдтӧдз став уличвывса уджсӧ эштӧдны».","Надо больше людей, чтобы до наступления холодов завершить все наружные работы».",,
100,Объект вылын уджалӧ 450 морт.,На объекте задействовано 450 человек.,,
101,Вӧчӧма шӧр стрӧитчан да монтажнӧй уджъяс.,Уже выполнены основные строительно-монтажные работы на полях и трибунах стадиона.,,
102,"Монтируйтӧма 6 югзьӧдан мачта, колӧ монтируйтны нӧшта кыкӧс.",Завершен монтаж 6 из 8 запланированных мачт освещения.,,
103,"Ӧні шӧр да запаснӧй полеяс вылын вӧчӧны йивыв ареналы кӧдздӧдан система, лӧсьӧдӧны трибунаа жыръяслысь пытшкӧссӧ, ывла вылын садитӧны пуяс да кустъяс.","В данный момент ведутся работы по устройству холодоснабжения ледовой арены на основном и запасном полях стадиона, внутренняя отделка трибунных помещений, озеленение территории.",,
104,"График серти уджӧ пырӧм могысь вуджисны кык сменаа удж вылӧ, отсӧг вылӧ корӧны карса олысьясӧс.","Для ликвидации отставания силами подрядной организации обеспечивается перевод привлеченной рабочей силы на двухсменный режим рабочего времени, организована работа по привлечению дополнительной рабочей силы из числа местных жителей.",,
105,Выльмӧдӧм бӧрас Сыктывкарын лоас ӧнія кадлы лӧсялана спорт объект.,После реконструкции Сыктывкар получит современный спортивный объект.,,
106,"Сэні лоӧ йивыв арена, котралан туйяс, стритбол да воркаут вылӧ площадкаяс, ворсан площадкаяс, тренируйтчан зал да легкоатлетическӧй манеж.","С ледовой ареной, беговыми дорожками, площадками для стритбола и воркаута, игровыми площадками, тренажерным залом и легкоатлетическим манежем.",,
107,Трибуна вылӧ тӧрас 8600-ысь унджык морт.,Общая вместимость трибун – более 8600 человек.,,
108,"5 пыранінӧ сувтӧдасны металлоискательяс, рентгенотелевизионнӧй установка, взрывчатӧй вещество ру тӧдмалӧм вылӧ газоанализаторъяс, объект вылын лоас 290 видеокамера.","5 входов будут оборудованы металлоискателями, рентгенотелевизионной установкой, газоанализаторами паров взрывчатых веществ, на объекты будет установлено 290 камер видеонаблюдения.",,
109,*** Республиканскӧй стадион выльмӧдсьӧ Коми Республикаын 2021 вося Мача хоккейысь мирса чемпионат кежлӧ.,*** Реконструкция Республиканского стадиона ведется в рамках подготовки к проведению в Республике Коми чемпионата мира по хоккею с мячом в 2021 году.,,
110,"Проект серти кӧсйӧны лӧсьӧдны видзӧдысьяслы навесъяс, спорт арена, а сідзжӧ сувтӧдны выль югзьӧдан мачтаяс, звукӧвӧй оборудование да юӧртан медиа-табло.","Проектом реконструкции предусмотрены устройство навесов над местами для зрителей, устройство спортивной арены, а также установка новых мачт освещения, звукового оборудования и информационного медиа-табло.",,
111,"Рытыввывса (шӧр) выль трибуналӧн медводдза судтаын кӧсйӧны меститны волысьяслы пыран зона, суддяяслы да спортсменъяслы пӧрччысянінъяс, содтӧд могъяс вылӧ жыръяс.","На первом этаже новой западной (центральной) трибуны планируется разместить входную зону для посетителей, раздевалки для судей и спортсменов, помещения вспомогательного назначения.",,
112,"Мӧд судтаын лоас нёль котралан туя выль легкоатлетическӧй манеж, баскетбольнӧй площадка да тренируйтчан залъяс, а сідзжӧ спортсменъяслы да болельщикъяслы кафе.","На втором этаже появится новый легкоатлетический манеж с четырьмя беговыми дорожками, баскетбольная площадка и тренажерные залы, а также кафе для спортсменов и болельщиков.",,
113,"Вылыс судтаясын лоасны конференц-зал, сӧвещаниеяс нуӧдан залъяс, прессалы зона, комментаторъяслы кабинаяс да техническӧй персоналлы жыръяс.","На верхних этажах здания разместятся конференц-зал, залы совещаний, зона для прессы, комментаторские кабины и комнаты для технического персонала.",,
114,Кутасны выльмӧдны и стадионлысь запаснӧй полесӧ.,Запланирована реконструкция и запасного поля стадиона.,,
115,"Сэні лоас кытшӧн да веськыда котралан туйяса выль спортивнӧй ядро, мача хоккейысь либӧ футболысь ворсан полеяс, быд сикас ворсӧм вылӧ площадка.","На нем появится новое спортивное ядро с круговой и прямой беговыми дорожками, поле для игры в хоккей с мячом или футбол, универсальная игровая площадка.",,
116,"Стадионсӧ потшасны, югзьӧдасны, сувтӧдасны звукӧвӧй да юӧртан оборудование, а сідзжӧ запаснӧй полеын кыпӧдасны видзӧдысьяслы 499 места вылӧ выль трибуна.","Будет выполнено ограждение стадиона, установка освещения, звукового и информационного оборудования, а также на запасном поле будет построена новая зрительская трибуна на 499 мест.",,
117,Коми язык,Русский язык,,
118,Владимир Уйба удж серти аддзысьліс Россия Федерация промышленносьт да вузасян министрӧс вежысь Виктор Евтуховкӧд ,Владимир Уйба провёл рабочую встречу с замминистра промышленности и торговли Российской Федерации Виктором Евтуховым ,,
119,Аддзысьлӧмыс вӧлі кӧч тӧлысь 8 лунӧ статс-секретар – Россия Федерация промышленносьт да вузасян министрӧс вежысь Виктор Евтуховлӧн Сыктывкарӧ удж кузя волігӧн.,Встреча состоялась 8 сентября в рамках рабочей поездки статс-секретаря – заместителя Министра промышленности и торговли Российской Федерации Виктора Евтухова в Сыктывкар.,,
120,"Сёрнитісны промышленносьт сӧвмӧдӧм, индустриальнӧй пу стрӧйбаяс кыпӧдӧм да пеллетъяс вӧчӧм йылысь.","Обсуждены вопросы развития промышленности, индустриального деревянного домостроения и пеллетного производства.",,
121,Та бӧрын Владимир Уйба да Виктор Евтухов видзӧдлісны “Комитекс” акционер котыр.,После встречи Владимир Уйба и Виктор Евтухов посетили АО «Комитекс».,,
122,Тайӧ котырыс кытӧм материалъяс да синтетическӧй волокно вӧчӧм серти Россияын медводдзаяс лыдын.,Одно из ведущих предприятий России по производству нетканых материалов и синтетического волокна.,,
123,Фабрика вӧчӧ 50 кымын сикас продукция промышленносьтлӧн быдсикас юкӧнлы.,Фабрика сегодня производит порядка 50 видов продукции для нужд различных отраслей промышленности.,,
124,Сійӧ вӧдитчӧ уна кытӧм материал “кос ногӧн” вӧчан технологияясӧн.,Обладает большинством известных в настоящее время в мире технологий производства нетканых материалов «сухим способом».,,
125,"Предприятие перерабатывайтӧ вторичнӧй сырьё, пӧртӧ олӧмӧ выль инвестиция проектъяс, выльмӧдӧ оборудование, и та вӧсна вермӧ лэдзны унджык да бур качествоа продукция.","Предприятие перерабатывает вторичное сырье, реализует новые инвестиционные проекты и осуществляет постоянную модернизацию оборудован",,
126,Виктор Евтухов висьталіс канмусянь отсӧг сетан мераяс йылысь.,Виктор Евтухов рассказал о действующих мерах государственной поддержки.,,
127,"Гӧгӧрвоӧдіс, кыдзи федеральнӧй сьӧм тшӧт весьтӧ босьтны лизинг кредит производство выльмӧдӧм вылӧ.","В частности, замминистра промышленности и торговли России пояснил, как за счет федеральных средств получить лизинговый кредит на обновление производственных линий.",,
128,Владимир Уйба да Виктор Евтухов сідзжӧ нуӧдісны Коми Республикаын вӧр лэдзан юкӧнын медтӧдчана инвестиция проектъяс серти сӧвещание.,Также Владимир Уйба и Виктор Евтухов провели совещание по вопросам реализации приоритетных инвестиционных проектов в области освоения лесов на территории Республики Коми.,,
129,"Министрӧс вежысь пасйис, мый Коми Республикаын вӧр промышленносьт комплекс сӧвмӧдӧм вермас вайӧдны республикаӧ инвесторъясӧс.","Министр отметил, что с точки зрения возможностей развития лесопромышленного комплекса Республика Коми – привлекательный регион для инвесторов.",,
130,Тані эм нин вӧр переработайтан кык ыджыд предприятие – “Монди Сыктывкарскӧй ЛПК” акционер котыр да “Лузалес” ичӧт кывкутана котыр.,"Здесь есть якорные предприятия лесопереработки, такие как АО «Монди Сыктывкарский ЛПК» и ООО «Лузалес».",,
131,“Вӧр переработайтӧмын медтӧдчана инвестиция проектъяс республикаын пӧртсьӧны олӧмӧ зэв бура.,«Приоритетные инвестиционные проекты по лесопереработке в республике реализуются весьма успешно.,,
132,"Асшӧр уджалысьяс асьныс бӧрйӧны кодарӧ сетчыны, – пасйис Виктор Евтухов.","Предприниматели сами определяют, в какую сторону им двигаться, - сказал Виктор Евтухов.",,
133,– Тіян сӧвмӧ пеллет вӧчӧм.,-  У вас развивается пеллетное производство.,,
134,Тайӧ аскиа лун.,Это очень перспективно.,,
135,"Но и талун нин ми сёрнитам сы йылысь, медым ломтыны пеллетӧн котельнӧйяс сэні, кӧні абу газ.","Сегодня мы говорим о переводе на это экологичное топливо котельных там, где нет газа.",,
136,Тайӧ тӧварыс бура мунӧ экспорт вылӧ .,Это очень востребованный экспортный товар.,,
137,"Та вӧсна ми пыртім пеллетъяссӧ продукция лыддьӧгӧ, кутшӧмӧс сьӧмӧн могмӧдӧны ортсыса рынокъяс вылӧ йӧзлы колана продукция нуны отсалан уджтас серти”.","Потому мы включили пеллеты в перечень продукции, которая субсидируется в рамках программы по поддержке транспортировки продукции гражданского назначения на внешние рынки».",,
138,"Владимир Уйба пасйис, мый республика ачыс вермас асьсӧ тырвыйӧ могмӧдны пеллетъясӧн.","Владимир Уйба отметил, что республика может полностью удовлетворить внутренний рынок пеллетами.",,
139,"Регионын эм сырьё да предприятиеяс, кодъяс вермасны содтыны ломтысян гранула вӧчан ӧд.","В регионе есть сырье и предприятия, которые могут наращивать производство топливных гранул.",,
140,"“Ми сёрнитім Виктор Леонидовичкӧд сійӧ проектъяс йылысь, кодъяс вермасны ыштӧдны инвесторъясӧс, – тӧдчӧдіс Коми Республикаса Юралысьлысь могъяс недыр кадколастӧ збыльмӧдысь.","«Мы обсудили с Виктором Леонидовичем ряд вопросов и проектов, которые свидетельствуют об инвестиционной привлекательности республики, - подчеркнул врио Главы Республики Коми.",,
141,"– Тайӧ абу сӧмын вӧр пӧрӧдӧм, но и вӧр переработайтӧм, колястӧм производство.","- Это не просто лесозаготовка, но и предприятия глубокой переработки древесины, безотходные производства.",,
142,"И, дерт, медтӧдчанаыс – социальнӧй проектъяс олӧмӧ пӧртӧм.","Ну, и, что особенно важно, это реализация социальных проектов.",,
143,"Шуам, “Лузалес” кӧсйӧ восьтыны Сыктывкарын ӧнія кадлы лӧсялана уна мога медицина шӧрин”.","В частности, мы посетили компанию «Лузалес», которая планирует открыть в Сыктывкаре современный многофункциональный медицинский центр».",,
144,Коми язык,Русский язык,,
145,Усинскса политехническӧй техникумын воссис «Сьӧкыдлунъяс венны велӧдан лаборатория» ,В Усинском политехническом техникуме открылся учебный полигон «Лаборатория Стрессоустойчивости» ,,
146,Лаборатория кыпыда воссис кӧч 7 лунӧ.,Лаборатория  состоялась 7 сентября.,,
147,Воліс сэтчӧ и Коми Республикаса Юралысьлысь могъяс недыр кадколастӧ збыльмӧдысь Владимир Уйба.,В торжественной церемонии в Усинске принял участие Владимир Уйба.,,
148,Регионӧн юрнуӧдысь аттьӧаліс «РН – Северная нефть» ичӧт кывкутана котырӧн веськӧдлысьясӧс – социальнӧй уджъёртъясӧс – отсӧг сетӧмысь.,"Временно исполняющий обязанности Главы Республики Коми поблагодарил руководство социального партнера ООО «РН – Северная нефть», при поддержке которого была создана лаборатория.",,
149,А студентъяслы сиис интереснӧй велӧдчӧм.,И пожелал студентам интересной и плодотворной учебы.,,
150,"“Велӧдчӧмыд, дерт, удж.","«Приобретение знаний, конечно, - это будни.",,
151,"Но татшӧм лабораторияас велӧдчыны лоӧ кокниджык да бурджык. ӧд тані ӧнія кадлы лӧсялана техника, удж симуляторъяс, – пасйис Владимир Уйба. - ӧнія кадся велӧдчӧм ёна торъялӧ 20‑30 вояс сайын велӧдчӧмысь.","Но благодаря такой лаборатории, современной технике, симуляторам процесс получения знаний становится интересным и наглядным, - отметил В. Уйба. – Современный образовательный процесс отличается от того, что был 20-30 лет назад.",,
152,Талун позьӧ велӧдчыны венны уджын сьӧкыдлунъяс да лёк лоӧмторъяс. Мед збыль уджалігас татшӧмторйыс эз вӧв.,"Сегодня можно моделировать ситуации, чтобы потом понимать, как действовать на практике.",,
153,Велӧдчигӧн тайӧ зэв тӧдчанатор”.,Это крайне важно при овладении профессией».,,
