,0,1
1746,"Тайӧ лои му пытшкӧсӧн вӧдитчысьлӧн наука-туялан институтъяскӧд да предприятиеяскӧд – «Аэрогеология» ФКӦНПП, «ВИМС» ФКСУ, «ВСЕГЕИ» ФКСУ, «ИМГРЭ» ФКСУ, РНА ИГЕМ да РНА ИМЕТ – 10 вося геологоразведочнӧй да туялана уджъяс серти кывкӧртӧдӧн.","Что стало результатом 10-летних геологоразведочных и исследовательских работ недропользователя с федеральными научно-исследовательскими институтами и предприятиями: ФГУНПП «Аэрогеология», ФГБУ «ВИМС», ФГБУ «ВСЕГЕИ», ФГБУ «ИМГРЭ», ИГЕМ РАН и ИМЕТ РАН."
1747,"Мупытшса озырлун видзас серти канму комиссия вынсьӧдіс видзассӧ 300,4 млн тонна титанӧвӧй руда да 345 млн тонна стеклӧа лыа чиръя из мындаын.","Государственная комиссия по запасам полезных ископаемых утвердила запасы в количестве 300,4 млн тонн титановых руд и 345 млн тонн стекольных песчаников."
1748,А сідзжӧ вӧлі донъялӧма водзӧ вылӧ ресурсъяс лицензияа площадь серти.,А также были оценены прогнозные ресурсы в пределах лицензионной площади.
1749,"Найӧ артмӧдісны 1012,5 млн тонна титанӧвӧй руда.","Которые составили 1012,5 млн тонн титановых руд."
1750,"«РУСТИТАН» компанияяслӧн группа Коми Республикаса Веськӧдлан котыркӧд Артмӧдчӧм серти пӧртӧ олӧмӧ Пижмаса куйлӧдын титанӧвӧй рудаяс да кварца (стеклӧа) лыаяс переработайтӧм серти вертикально-интегрированнӧй горно-металлургическӧй комплекс стрӧитӧм серти инвестиция проект, а сідзжӧ пырӧдчӧ Коми Республикаын меститчысь титан, кварц да мукӧд сикас минеральнӧй сырьёлысь куйлӧдъяс комплекснӧя перйӧм могысь национальнӧй горнопромышленнӧй кластер лӧсьӧдӧмӧ.","ГК «РУСТИТАН» на основании Соглашений о сотрудничестве с Правительством Республики Коми реализует инвестиционный проект по строительству вертикально интегрированного горно-металлургического комплекса по переработке титановых руд и кварцевых (стекольных) песчаников Пижемского месторождения, а также участвует в создании национального горнопромышленного кластера для комплексного освоения месторождений титанового, кварцевого и других видов минерального сырья, расположенных на территории Республики Коми."
1751,"Коми Республикаын чукӧрмӧма титан да кварцлӧн мирын медыджыд ресурсъяс, мый урчитӧ регионлысь аскиа лунсӧ, кыдз минеральнӧй сырьё перйӧм серти да промышленносьтлысь быдсяма отрасль могмӧдӧм могысь титан да кварц диоксидъяс подув вылын бур продукция сыысь вӧчысь мирса шӧринлысь.","В недрах Республики Коми сосредоточены крупнейшие в мире ресурсы титанового и кварцевого сырья, предопределяющие будущее региона, как мирового центра по добыче минерального сырья и производства из него высокосортной продукции на основе диоксидов титана и кварца с целью обеспечения различных отраслей промышленности."
1752,"Производство продукциялӧн шӧр сикасъяс – ёна пористӧй рутиллысь да псевдорутиллысь концентратъяс, титанлӧн пигментнӧй диоксид, аддитивнӧй технологияяслы (3D печать) титан пызь, синтетическӧй игольчатӧй волластонит, аслыспӧлӧс керамика да полимеръяс, экология боксянь сӧстӧм стрӧитчан материалъяс.","Основными видами продукции, планируемые к производству, являются концентраты высокопористого рутила и псевдорутила, пигментный диоксид титана, титановые порошки для аддитивных технологий (3D печать), синтетический игольчатый волластонит, специальная керамика и полимеры, экологически чистые строительные материалы."
1753,"«Транспорт, энергетика да юӧр сетан инфраструктураа национальнӧй горнопромышленнӧй кластер лӧсьӧдӧм лоӧ республикалӧн стратегическӧй могӧн, - тӧдчӧдіс Коми Республикаса Юралысь Владимир Уйба.","«Создание национального горнопромышленного кластера с транспортной, энергетической и информационной инфраструктурой является стратегической задачей для республики, - подчеркнул Глава Республики Коми Владимир Уйба."
1754,Тайӧ сетас позянлун кутчысьны выльӧ да сӧвмӧдны уджалысь нин проектъяс Коми Республика да Россияса Арктика зона социальнӧя да экономика боксянь сӧвмӧдӧм понда».,Это позволит начать новые и развивать уже действующие проекты в интересах социально-экономического развития Республики Коми и Арктической зоны России».
1755,"Инвестиция проектсӧ пыртӧма 2035 воӧдз кадколаст вылӧ Коми Республикаӧс социальнӧя да экономика боксянь сӧвмӧдан стратегияӧ, а сідзжӧ 2035 воӧдз кадколаст вылӧ Россия Федерацияса Арктика зона сӧвмӧдан да национальнӧй безопасносьт могмӧдан стратегияӧ.","Инвестпроект включен в Стратегию социально-экономического развития Республики Коми на период до 2035 года, а также в Стратегию развития Арктической зоны Российской Федерации и обеспечение национальной безопасности на период до 2035 года."
1756,Коми язык,Русский язык
1757,Коми Республикаса Веськӧдлан котыр да Россияса кластеръяслӧн да технопаркъяслӧн ассоциация костын кырымалӧма ӧтувъя удж йылысь артмӧдчӧм ,Подписано соглашение о сотрудничестве между Правительством Коми и Ассоциацией кластеров и технопарков России 
1758,Документсӧ кырымалісны Коми Республикаса Юралысь Владимир Уйба да Ассоциацияса директор Андрей Шпиленко.,Документ подписали Глава Республики Коми Владимир Уйба и директор Ассоциации Андрей Шпиленко.
1759,"Ёртасьӧмлӧн шӧр нырвизьяс лыдын – Коми Республикалысь вермасьны кужӧмсӧ да научно-техническӧй, инновационнӧй да промышленнӧй верманлунсӧ кыпӧдӧм могысь кластеръяс да технопаркъяс лӧсьӧдӧм да сӧвмӧдӧм; регионлысь промышленнӧй инфраструктура сӧвмӧдӧм да инвестиция позянлунъяссӧ кыпӧдӧм, инвесторъясӧс кыскӧм.","В числе основных направлений сотрудничества – создание и развитие кластеров и технопарков в целях повышения конкурентоспособности и развития научно-технического, инновационного и промышленного потенциала Республики Коми; развитие промышленной инфраструктуры и повышение инвестиционной привлекательности региона, привлечение инвесторов."
1760,Торъя тӧжд – преференциальнӧй нога асшӧр удж нуӧдан мутасъяс лӧсьӧдӧм.,Особое внимание будет уделено созданию территорий с преференциальными режимами ведения предпринимательской деятельности.
1761,«Коми Республикаын абуӧсь на технопаркъяс.,«На территории Республики Коми пока нет технопарков.
1762,"Но миян регионлӧн зэв ыджыд инвестиция позянлун, - пасйис Владимир Уйба.","Но наш регион обладает огромным инвестиционным потенциалом, - отметил Владимир Уйба."
1763,"– Эска, мый Коми Республика да Ассоциация костын кырымалӧм Артмӧдчӧмыс кутас отсавны збыльмӧдны национальнӧй проектъяс да сӧвмӧдны регионнымӧс социальнӧя да экономика боксянь».","– Уверен, что подписание Соглашения между Республикой Коми и Ассоциацией будет способствовать эффективной реализации национальных проектов и социально-экономическому развитию региона»."
1764,«Ми заводитім нин збыльмӧдны тайӧ артмӧдчӧмсӧ.,«Мы уже приступили к реализации этого соглашения.
1765,Россияса кластеръяслӧн да технопаркъяслӧн ассоциация нуӧдӧ Сыктывкарын регионса предприятиеяскӧд ӧтув ыджыд стратегическӧй сессия.,В Сыктывкаре Ассоциация кластеров и технопарков России проводит большую стратегическую сессию с участием предприятий региона.
1766,"Миян мог – бизнескӧд ӧттшӧтш талун нин аддзыны потенциальнӧй площадкаяс, кодъяс вермисны босьтны промышленнӧй технопарклысь статус.","И наша задача – уже сегодня вместе с бизнесом выявить потенциальные площадки, которые могли бы получить статус промышленного технопарка."
1767,"Артмӧдчӧм серти Ассоциация ёнмӧдас Коми Республикаын промышленнӧй кластеръяс лӧсьӧдӧм серти удж», - юӧртіс Андрей Шпиленко.","В рамках соглашения Ассоциация усилит работу по созданию промышленных кластеров в Республике Коми», - сообщил Андрей Шпиленко."
1768,Сыктывкарӧ волігӧн А. Шпиленко ветліс ӧткымын промышленнӧй предприятие вылӧ да спикераліс Коми Республикаса асшӧр уджалысьяслы стратегическӧй сессия уджын.,В ходе визита в Сыктывкар А. Шпиленко посетил ряд промышленных предприятий и принял участие в качестве спикера в стратегической сессии для предпринимателей Республики Коми.
1769,Сессиясӧ нуӧдісны ӧшым тӧлысь 3 лунӧ кластеръяс да технопаркъяс сӧвмӧдӧм тема серти «Менам бизнес» шӧрин отсӧгӧн.,Которая состоялась 3 декабря при поддержке центра «Мой бизнес» по теме развития кластеров и технопарков.
1770,Сессияӧ пырӧдчысьяс сёрнитісны Коми Республикаын промышленнӧй кластеръяс артмӧдан туй карта лӧсьӧдӧм йылысь.,Участники сессии обсудили разработку дорожной карты формирования промышленных кластеров в Республике Коми.
1771,"Россияса кластеръяслӧн да технопаркъяслӧн ассоциацияса экспертъяс висьталісны регионын промышленнӧй производство ышӧдан инструментъяс йылысь, на лыдын и канмусянь отсӧг сетан мераяс йылысь.","Эксперты Ассоциации кластеров и технопарков России рассказали об инструментах стимулирования промышленного производства в регионе, в том числе о мерах государственной поддержки."
1772,Фотоыс: В. Шешкунаслӧн («Комиинформ» юӧр сетысь агентстволӧн);,"Фото: В. Шешкунас (ИА ""Комиинформ"");"
1773,В. Бобырьлӧн,В. Бобырь
1774,Коми язык,Русский язык
1775,Владимир Уйба воліс Сыктывкар бердса Краснозатонскӧй посёлокын челядьӧс реабилитируйтан шӧринӧ ,Владимир Уйба посетил детский реабилитационный центр в сыктывкарском посёлке Краснозатонский 
1776,"Коми Республикаса Юралысь тӧдмасис учреждениелӧн тэчасӧн, сёрнитіс уджалысьяскӧд, а сідзжӧ чолӧмаліс воспитанникъясӧс локтысь Выль воӧн.","Глава Республики Коми ознакомился с инфраструктурой учреждения, пообщался с коллективом, а также поздравил воспитанников с наступающим Новым Годом."
1777,"Иван Павлович Морозов нима дзоньвидзалунын дзескӧдӧм позянлуна челядьӧс да ныв-зонпосниӧс реабилитируйтан республиканскӧй шӧрин – аслыссяма учреждение, кӧні сетӧны отсӧг органическӧя висьысь вей системаа да лёка ветлысь челядьлы.","Республиканский реабилитационный центр для детей и подростков с ограниченными возможностями имени Ивана Павловича Морозова – это уникальное учреждение, в котором получают помощь дети с органическим поражением центральной нервной системы и нарушениями опорно-двигательного аппарата."
1778,Шӧриныс меститчӧ Льӧмъюса пожӧма ягын.,Центр расположен в сосновом бору местечка Лемью.
1779,"Тані эм ставыс, мый колӧ социальнӧя могмӧдӧм вылӧ: эмӧсь сутки чӧж олысь челядьлы 5 узьлан корпус, медицина да велӧдан вежӧсъяс, овмӧс да администрация корпус.","Здесь созданы необходимые условия для социального обслуживания: имеется 5 спальных корпусов для круглосуточного проживания детей, медицинский и учебный блоки, хозяйственный и административный корпуса."
1780,"Челядьӧс реабилитируйтан уджтаслӧн шӧр могыс – кужанлун да тӧдӧмлун сӧвмӧдӧм, педагогическӧй коррекция, физическӧя да социальнӧя адаптируйтӧм, медицина отсӧг сетӧм.","Основной задачей программ реабилитации для детей является поэтапное развитие навыков и умений, педагогическая коррекция, постоянная физическая и социальная адаптация, медицинская помощь."
1781,"«И.П. Морозов нима РШ» Коми Республикаса канму сьӧмкуд учреждениелӧн аслыспӧлӧслуныс сыын, мый коррекционнӧй уджыс мунӧ лунтыр дугдывтӧг.",Уникальность организации реабилитационного процесса в ГБУ РК «РЦ им. И.П. Морозова» заключается в непрерывности коррекционного воздействия на протяжении всего дня.
1782,"Кагакӧд уджалӧ шӧринса став специалистыс, на лыдын логопед, психолог, музыка велӧдысь да отсасян персонал, кодъяс пӧртӧны олӧмӧ учреждениелысь шӧр мог – тырвыйӧ отсавны быд кагалы сылысь аддзӧм торксьӧмъяссӧ бурдӧдӧмын.","С ребёнком работают все специалисты Реабилитационного центра, включая логопеда, психолога, музыкального руководителя, медицинский работников и вспомогательного персонала, реализуя общую задачу учреждения – максимально помочь ребёнку в коррекции выявленных нарушений, дефектов. "
1783,Быд кагалы бӧрйӧны сӧмын сылы лӧсялана методика.,При этом для каждого ребёнка подбирается индивидуальная методика.
1784,"Тайӧ сетӧ позянлун велӧдны челядьӧс и тшӧтш бурдӧдны. Артмӧ ӧтувъя коррекционно-педагогическӧй удж, кытчӧ пырӧ кагалысь вӧран функция, сёрни да олӧм гӧгӧрвоӧм сӧвмӧдӧм серти удж.","Это позволяет осуществлять образование детей в учреждении в единстве с комплексной коррекционно-педагогической работой, охватывающей двигательную сферу ребенка, его речь и познавательную деятельность в целом."
1785,Учреждениеӧн тӧдмасьӧм бӧрын Коми Республикаса Юралысь Владимир Уйба сетіс уджалысьяслы Коми Республикаса канму наградаяс.,Ознакомившись с его работой Глава Республики Коми Владимир Уйба вручил сотрудникам государственные награды Республики Коми.
1786,"«Муӧдз копыр учреждениеса став уджалысьлы челядьлы отсӧг сетӧмысь, тайӧ збыль зэв колана удж.","«Низкий поклон всем сотрудникам учреждения за служение детям, это поистине благородный труд."
1787,"Абу кокни быд лун аддзыны мортлысь, торйӧн нин челядьлысь, висьӧм.","Очень непросто каждый день сталкиваться с человеческим недугом, а с детским тем более."
1788,"Но мортыс кӧ локтіс татчӧ да сетӧ асьсӧ челядьлы, то тайӧ ыджыд миссия.","Но если человек сюда пришёл и служит детям, то это уже великая миссия."
1789,"Зэв ыджыд аттьӧ тіянлы таысь», - аттьӧаліс В. Уйба.","За это всем вам огромное человеческое спасибо», - поблагодарил В. Уйба."
1790,"Волӧм бӧрын Владимир Уйба сетіс тшӧктӧм Коми Республикаса удж, уджӧн могмӧдан да социальнӧя доръян министерстволы, Коми Республикаын вермытӧм йӧзӧс, на лыдын и вермытӧм челядьӧс, реабилитируйтан да абилитируйтан ӧтувъя система серти, корсьны позянлун вӧчны учреждениесӧ уна нырвизьын уджалысь шӧринӧн каникулъяс дырйи удж котыртӧмӧн, челядьлысь, кодъяслы сетӧны отсӧг, категорияяс паськӧдӧмӧн, республикаса ылі кар-районъясын олысь унджык челядьлы отсӧг сетӧмӧн.","По итогам посещения Владимир Уйба поручил Министерству труда, занятости и социальной защиты Республики Коми, в рамках формирования системы комплексной реабилитации и абилитации инвалидов, в том числе детей-инвалидов в Республике Коми, проработать вопрос о возможности развития учреждения в статусе многопрофильного центра, в том числе с организацией работы в каникулярное время, расширением категорий обслуживаемых детей, увеличением количества обслуживаемых детей, проживающих в отдалённых городах и районах республики."
1791,*** Коми Республикаса Юралысьлӧн Индӧдӧн Коми Республикалӧн бура сӧвмӧм вылӧ уна во зіля уджалӧмысь Коми Республикаса почёт грамота сетӧма,"*** Указом Главы Республики Коми, за многолетнюю плодотворную работу, направленную на благо Республики Коми Почётной грамотой Республики Коми награждена"
