,0,1
903,"Подӧн вуджанінъяслӧн ӧтувъя лыдысь 80-ысь унджык прӧчент подӧн вуджанінсӧ лӧсьӧдӧма Ухтаын (85%), Вуктылын (84%), Луздор (87%) да Сыктыв районъясын (84%).","Более 80 % от общего числа пешеходных переходов оборудованы в г. Ухта (85 %), г. Вуктыл (84 %), Прилузский (87 %) и Сысольский (84 %) районы."
904,Республиканскӧй комиссиялӧн протокольнӧй помшуӧм серти 2021 во чӧжӧн муниципалитетъяслы ГИБДД Коми Республикаын веськӧдланінкӧд ӧтув колӧ нуӧдны став подӧн вуджанінъяслысь ревизия да помӧдз лӧсьӧдны ГОСТ серти велӧдан учреждениеяс дорын меставывса тӧдчанлуна автомашина туйяс подӧн вуджанінъяссӧ.,"В соответствии с протокольным решением республиканской комиссии муниципалитетам необходимо провести в течение 2021 года ревизию совместно с Управлением ГИБДД по Республике Коми всех пешеходных переходов и завершить работу по приведению в соответствии с ГОСТом пешеходных переходов, расположенных на автодорогах местного значения вблизи общеобразовательных учреждений."
905,Коми язык,Русский язык
906,Ухтаын капитальнӧя дзоньталӧны «Нефтяник» спорткомплекс ,В Ухте ведутся работы по капитальному ремонту спортивного комплекса «Нефтяник» 
907,Ӧшым тӧлысь 22 лунӧ Ухтаӧ удж серти воліс Коми Республикаса Юралысь Владимир Уйба да видзӧдліс объектсӧ.,22 декабря в ходе рабочей поездки в Ухту объект посетил Глава Республики Коми Владимир Уйба.
908,"Регионын тайӧ медводдза спорткомплекс, Ухтаын дзик ӧти, кӧні эм футболысь да хоккейысь ворсанінъяс.","Это первый спорткомплекс, построенный в Республике Коми, единственный в Ухте, имеющий футбольное поле и хоккейный корт."
909,Спорткомплексын нуӧдӧны карса да регионса ордйысьӧмъяс.,Спорткомплекс является местом проведения городских и региональных соревнований.
910,Тані ворсӧны карса челядьлы да томуловлы спорт секцияясысь быдтасъяс.,Здесь занимаются воспитанники детско-юношеских спортивных секций города.
911,Спорткомплекссӧ капитальнӧя эз дзоньтавлыны 1961 восянь. Сэки сійӧс вӧлі пыртӧма уджсӧ.,Капитальный ремонт спорткомплекса не проводился с момента ввода в эксплуатацию c 1961 года.
912,«Нефтяник» комплекссӧ дзоньталӧм да оборудуйтӧм вылӧ сьӧмсӧ вичмӧдіс «Транснефть» йӧзлы восьса акционер котыр.,Средства на ремонт и оснащение оборудованием выделены ПАО «Транснефть».
913,«Транснефть-Север» акционер котырса медыджыд директор Рустэм Исламов юӧртіс республикаса Юралысьлы проект збыльмӧдӧм йылысь.,Генеральный директор АО «Транснефть-Север» Рустэм Исламов доложил главе республики о ходе реализации проекта.
914,"Таво йирым тӧлысьын пӧдраднӧй организация босьтчис вӧчны стрӧитчан да монтажнӧй уджъяс, мый серти капитальнӧя дзоньталӧны да могмӧдӧны спорт оборудованиеӧн комплекссӧ.","В октябре этого года подрядная организация приступила к строительно-монтажным работам, в рамках которых выполняется капитальный ремонт и оснащение спортивным оборудованием «Нефтяника»."
915,"Ӧні нин вӧчӧма вевт, разьӧма спорткомплекс пытшкӧссӧ, дасьтысьӧны стрӧитчан медшӧр уджъяс кежлӧ вынсьӧдӧм график серти.","В данный момент смонтирована кровля, выполнены демонтажные работы внутри спорткомплекса, ведётся подготовка к основным строительным работам согласно утверждённому графику."
916,«Нефтяник» спорткомплекслысь зданиесӧ да сылысь сооружениеяссӧ помаласны дзоньтавны Коми Республикалы 100 во тыригкежлӧ 2021 вося моз тӧлысьын.,Общестроительные и монтажные работы здания и сооружений спорткомплекса «Нефтяник» будут завершены к 100-летию Республики Коми в августе 2021 года.
917,"Таысь кындзи, бурмӧдісны ытваысь видзчысян вал.","Кроме этого, завершено восстановление противопаводкового вала."
918,Сійӧ вӧлі мыйтакӧ киссьӧма да уна во нин эз видз ытваысь.,Который был частично разрушен и не обеспечивал защиту от наводнения на протяжении многих лет.
919,"Уськӧдам тӧд вылӧ, мый таво тулыснас Ухтаын ытваыс вӧлі зэв ыджыд, ваыс воліс критическӧй тшупӧдӧдз.","Напомним, что весной этого года в Ухте был зафиксирован критический уровень паводка в реке."
920,Сы вӧсна  ойдліс «Нефтяник» спорткомплексыс да сылӧн йӧрыс.,В результате чего был подтоплен спорткомплекс «Нефтяник» и вся прилегающая территория.
921,Коми язык,Русский язык
922,Комиын ошкисны 2020 воын ТЭК уджӧн тӧдмӧдӧмысь ,В Коми поощрили за освещение деятельности ТЭК в 2020 году 
923,"Коми Республикалӧн Каналан Сӧветса ыджыд залын кыпыд мероприятие вылӧ чукӧртчисны регионса Веськӧдлан котырӧ пырысьяс, ТЭК предприятиеясӧн да пресс-службаясӧн юрнуӧдысьяс, СМИ петкӧдлысьяс.","На торжественном мероприятии в большом зале Госсовета республики собрались члены республиканского правительства, руководители предприятий ТЭК и пресс-служб, представители СМИ."
924,"Коми Республикаса Веськӧдлан котырӧн Юрнуӧдысьӧс Медводдза вежысь Игорь Булатов чолӧмаліс ставнысӧ Энергетиклӧн кольӧм лунӧн да тӧдчӧдіс, мый быть колӧ гижны-юӧртны энергетикъяслӧн удж да ТЭК сӧвмӧдан проектъяс йылысь.",С приветственным словом к собравшимся обратился Первый заместитель Председателя Правительства Республики Коми Игорь Булатов. Он поздравил всех с прошедшим Днем энергетика и подчеркнул важность информационного освещения деятельности энергетической отрасли и проектов развития ТЭК.
925,Мероприятиеӧ пырӧдчысьяс видеосвязь пыр видзӧдісны МедиаТЭК-2020 ставроссияса конкурслӧн федеральнӧй тшупӧдын вермысьяслы наградаяс сетан церемониясӧ.,Участники мероприятия по видеосвязи режиме присоединились к церемонии награждения победителей федерального этапа всероссийского конкурса МедиаТЭК-2020.
926,Трансляциясӧ нуӧдісны «Россия сегодня» войтыркостса юӧртан агентстволӧн москваса студиясянь.,Трансляция велась из московской студии МИА «Россия сегодня».
927,"Кыдзи и федеральнӧй уджъёртъяс, трансляция помын пасйисны Коми Республикаӧс петкӧдлысьясӧс, кодъяс тӧдмӧдӧны энергетика системаса предприятиеяслӧн уджӧн.","По окончании трансляции по примеру федеральных коллег отметили и представителей от Республики Коми, освещающих деятельность предприятий энергетической системы."
928,«Челядьӧс биару отрасльын уджсикасъясӧн паськыда тӧдмӧдӧмын да быдлунъя олӧмын биаруӧн колана ногӧн вӧдитчӧмӧн паськыда тӧдмӧдӧмын  творческӧя уджалӧмысь» номинацияын МедиаТЭК-2020 ставроссияса конкурслӧн Экспертнӧй сӧветсянь торъя приз сетӧма «Газпром трансгаз Ухта» ичӧт кывкутана котырлы.,Спецпризом Экспертного совета Всероссийского конкурса «МедиаТЭК-2020» в номинации «За творческий подход в популяризации профессий газовой отрасли среди детей и пропаганду безопасного использования газа в быту» награждено общество с ограниченной ответственностью «Газпром трансгаз Ухта».
929,Игорь Булатов сетіс компанияса медыджыд директор Александр Гайворонскийлы торъя приз да диплом.,Игорь Булатов вручил спецприз и диплом генеральному директору компании Александру Гайворонскому.
930,Коми Республикаса топливно-энергетическӧй комплекслӧн уджӧн тӧдмӧдӧмын бура уджалӧмысь Коми Республикаса Веськӧдлан котырӧн Юрнуӧдысьӧс Медводдза вежыссянь аттьӧалана гижӧд сетӧма «Комиинформ» юӧртан агентствоса шеф-редактор Илья Бакановлы.,За активную работу по освещению деятельности топливно-энергетического Республики Коми благодарственным письмом Первого заместителя Председателя Правительства Республики Коми отмечен шеф-редактор информационного агентства «Комиинформ» Илья Баканов.
931,"*** «МедиаТЭК» ставроссияса конкурссӧ нуӧдӧны 2015 восянь топливно-энергетическӧй комплекслӧн да регионъясса администрацияяслӧн йӧзӧс юӧртан средствояс, журналистъяс, йӧзкӧд йитӧд кутан юкӧнъяс костын.","*** Всероссийский конкурс «МедиаТЭК» проводится с 2015 года среди средств массовой информации, журналистов, отделов по связям с общественностью компаний топливно-энергетического комплекса и региональных администраций."
932,"Конкурслӧн медшӧр мог – сӧвмӧдны энергетика компанияяслысь асланыс уджӧн тӧдмӧдӧмсӧ, йӧзлы ТЭК сӧвмӧдан проектъяс йылысь юӧртӧмсӧ, ышӧдны сы вылӧ, медым лӧсьӧдісны топливно-энергетическӧй комплексын уджсикасъясӧн паськыда тӧдмӧдӧмкӧд йитчӧм проектъяс да кыпӧдісны энергетикъяслӧн, мусир да биару перйысьяслӧн уджлысь тӧдчанлунсӧ.","Основная цель конкурса – стимулирование роста профессионализма энергетических компаний в области информационного освещения своей деятельности, донесения информации до населения о проектах развития ТЭК, стимулирование проектов, связанных с популяризацией профессий топливно-энергетического комплекса и повышения значимости роли труда энергетиков, нефтяников, газовиков."
933,"2020 воын ыджыд пай пуктӧма COVІD-19 дырйи ТЭК предприятиеяслӧн уджӧн тӧдмӧдӧмӧ, Айму вӧсна Ыджыд тышын вермӧмсянь 75 во да ГОЭЛРО план примитӧмсянь 100 во тырӧмсӧ пасйӧм кежлӧ проектъяс олӧмӧ пӧртӧмӧ.","В 2020 году особое внимание уделено освещению деятельности предприятий ТЭК в условиях COVID-19, реализации проектов к празднованию 75-летия Победы в Великой Отечественной войне и 100-летию принятия плана ГОЭЛРО."
934,Коми язык,Русский язык
935,«Велӧдӧм» национальнӧй проект: Ухтаын воссис «Кванториум» челядьлы технопарк ,Нацпроект «Образование»: в Ухте заработал детский технопарк «Кванториум» 
936,"Национальнӧй проект збыльмӧдӧм серти Коми Республикаса нӧшта ӧти карын воссис ӧнія площадка, кӧні челядь да томулов вермӧны велӧдчыны выльторйӧ да коллявны прӧст кад.",Благодаря реализации национального проекта в ещё одном городе Республики Коми появилась современная инновационная площадка интеллектуального развития и досуга детей и подростков.
937,Челядьлы технопарклӧн позянлунъясӧн тӧдмасис Коми Республикаса Юралысь Владимир Уйба.,С образовательными возможностями детского технопарка ознакомился Глава Республики Коми Владимир Уйба.
938,"Челядьлы технопаркын эм вылыс технологияа оборудование, сэні дасьтӧны вылыс квалификацияа инженернӧй кадръясӧс, лӧсьӧдӧны, тестируйтӧны да пыртӧны выль технологияяс да мӧвпъяс.","Детский технопарк оснащен высокотехнологичным оборудованием, нацелен на подготовку новых высококвалифицированных инженерных кадров, разработку, тестирование и внедрение инновационных технологий и идей."
939,Кванториумъяслӧн могыс – бур велӧдан модельяс пыртӧмӧн техническӧя сӧвмӧдны челядьӧс да отсавны россияса томуловлы сӧвмыны наукаын да техникаын.,"Миссия Кванториумов заключается в содействии ускоренному техническому развитию детей и реализации научно-технического потенциала российской молодёжи, внедряя эффективные модели образования."
940,"Талун Ухтаын олӧ 5 арӧссянь 18 арӧсӧдз 17 сюрс сайӧ челядь да томулов, на лыдысь 72%-ысь унджыкыс велӧдчӧны содтӧд тӧдӧмлун сетан уджтасъяс серти.","Сегодня в Ухте проживает более 17 тысяч детей и подростков в возрасте от 5 до 18 лет, из них более 72% охвачены программами дополнительного образования."
941,"Велӧдан уджтасъяссӧ збыльмӧдӧны вит квантум (нырвизь) серти, кӧні велӧдчӧ 800 ныв-зон (140-ӧн – промдизайнквантумын да IT квантумын, 120-ӧн – Робоквантумын да аэроквантумын, 70 – автоквантумын) – тайӧ карса да каргӧгӧрса школаясын, а сідзжӧ шӧр тшупӧда уджсикасӧ велӧдан учреждениеясын велӧдчысьяс.","Образовательные программы реализуются по пяти квантумам (направлениям), в которых обучаются 800 детей (по 140 детей в промдизайнквантуме и IT-квантуме, по 120 детей в Робоквантуме и аэроквантуме, 70 детей в автоквантуме) – это учащиеся школ города и пригорода, а также учреждений среднего профессионального образования."
942,8-12 арӧса челядьлы технопаркын збыльмӧдӧны «Квантумстарт» уджтас.,Для детей от 8 до 12 лет в технопарке реализуется программа «Квантумстарт».
943,"Сылӧн могыс – тӧдмавны, мыйӧ кӧсйӧ велӧдчыны кагаыс, медым велӧдны сійӧс колана уджтас серти.",Цель которой состоит в выявлении интереса ребёнка для дальнейшего зачисления его на интересующего программу.
944,"Тайӧ уджтасын куим блок: программируйтӧм, схемотехника да дизайн.","Данная программа состоит из трёх блоков: программирование, схемотехника и дизайн."
945,Быд блок велӧдӧны 3 тӧлысь чӧж.,Каждый блок изучается 3 месяца.
946,«Квантумстарт» серти велӧдчӧ 210 челядь.,По «Квантумстарту» обучается 210 детей.
947,"Сы могысь, медым сетны выль тӧдӧмлунъяс ылі сикт-грездъясса челядьлы, Ухтаын заводитіс уджавны мобильнӧй технопарк.",Для погружения ребят из отдаленных населённых пунктов в мир новых знаний в Ухте начал работать мобильный технопарк.
948,"Тайӧ велӧдчан воӧ мобильнӧй технопаркын кутасны велӧдчыны Ярега, Воднӧй, Шудаяг, Улыс Одес посёлокъясысь, Сосногорск да Вуктыл каръясысь челядь.","В этом учебном году в мобильном технопарке будут заниматься ребята из шести населённых пунктов: посёлков Ярега, Водный, Шудаяг, Нижний Одес, городов Сосногорск и Вуктыл."
949,"2020-2021 велӧдчан воӧ 3 сюрс сайӧ ныв-зон вермасны босьтны содтӧд тӧдӧмлунъяс да техникаын выль кужанлунъяс татшӧм нырвизьяс серти: гео/аэроквантум, VR/AR да IT-квантум, промробо-промдизайнквантум.","Более 3 тысяч ребят в 2020-2021 учебном году смогут получить дополнительное образование и новые технические навыки по трём направлениям: гео/аэроквантум, VR/AR и IT-квантум, промробо-промдизайнквантум."
950,Ӧти кадӧ тані вермас уджавны 6 велӧдчысь.,Одновременно здесь смогут работать 6 учащихся.
951,"Автомашинаын ӧнія вылыс технологияа оборудование – тайӧ быд велӧдчысь вылӧ 3D-принтеръяс, лазернӧй да фрезернӧй станокъяс, квадрокоптеръяс, паяльнӧй станцияяс, ноутбукъяс.","Автомобиль наполнен современным высокотехнологичным оборудованием – это 3D-принтеры, лазерный и фрезерный станки, квадрокоптеры, паяльные станции, ноутбуки для каждого учащегося."
952,"«Зэв бур, мый миян челядьлӧн эм позянлун лоны трендын, босьтны IT-сфераын выль тӧдӧмлунъяс, велӧдчыны компьютернӧй веськӧдлӧмӧ, дизайнӧ, графикаӧ да мукӧдторйӧ.","«Здорово, что у наших детей сегодня есть возможность быть в тренде, получать новые знания и навыки в IT-сфере, изучать компьютерное управление, дизайн, графику и многое другое."
953,"Тайӧ дзик мӧд тшупӧда дасьтӧм да, дерт, татшӧм кванториум бӧрад челядьтӧ радпырысь босьтасны быд колледжӧ да университетӧ» - тӧдчӧдіс Коми Республикаса Юралысь.","Это подготовка совершенно другого уровня и, конечно, после такого кванториума любой колледж и университет с удовольствием будет принимать таких ребят» - подчеркнул Глава Республики Коми."
954,Коми язык,Русский язык
955,Прӧйдитіс РСЧС-са Коми республиканскӧй системаувлӧн да Коми Республикаса войтырӧс дорйӧмӧн веськӧдлысьяслӧн быдвося чукӧртчӧм ,Состоялся ежегодный сбор с руководящим составом Коми республиканской подсистемы РСЧС и гражданской обороны Республики Коми 
